,id,name,year,run_time,genre,rating,about,director,actors,votes,gross
158,159,Lore,2012,109 min,"Drama, Romance, War            ",7.1,"he Allies sweep across Germany, Lore leads her siblings on a journey that exposes them to the truth of their parents' beliefs. An encounter with a mysterious refugee forces Lore to rely on a person she has always been taught to hate.",Cate Shortland ,"Saskia Rosendahl, Kai-Peter Malina, Nele Trebs, Ursina Lardi",14803,$0.97M
159,160,Nebel im August,2016,121 min,"Drama, War            ",7.3,"ma boy is placed in a mental hospital and experiences the Nazi euthanasia program. Aware of what was happening and attached to friends, the lad attempts to sabotage the program. The ...                See full summary »
",Kai Wessel ,"Ivo Pietzcker, Sebastian Koch, Thomas Schubert, Fritzi Haberlandt",2283,
160,161,Zona hostil,2017,93 min,"Action, Drama, Thriller            ",6.3,"fghanistan, a Spanish medevac is sent behind enemy/Taleban lines. Bad landing destroys the rotor. They are spotted by the Taleban. Can they and the chopper be rescued in time?",Adolfo Martínez Pérez ,"Ariadna Gil, Raúl Mérida, Roberto Álamo, Antonio Garrido",1619,
161,162,Alatriste,2006,145 min,"Action, Adventure, Drama            ",6.1,"o Mortensen plays the Spanish soldier-turned-mercenary Captain Alatriste, a heroic figure from the country's 17th century imperial wars.",Agustín Díaz Yanes ,"Viggo Mortensen, Elena Anaya, Unax Ugalde, Eduard Fernández",12848,
162,163,1898. Los últimos de Filipinas,2016,105 min,"Drama, History, War            ",6.5,ldiers trapped inside a church as last refugee. A fight that no one couldn't win. A war that no one wanted to lose.,Salvador Calvo ,"Luis Tosar, Javier Gutiérrez, Álvaro Cervantes, Karra Elejalde",3112,
163,164,Shpion,2012,108 min,"Action, Drama, Thriller            ",5.4,"he spring of 1941 German agent Wasser of the Abwehr holds an NKVD commissar hostage. Two soldiers, a boxer and a spy are the NKVD's only hope to rescue him.",Aleksey Andrianov ,"Danila Kozlovskiy, Fedor Bondarchuk, Anna Chipovskaya, Sergey Gazarov",1231,
164,165,Köshpendiler,2005,112 min,"Drama, History, War            ",5.9,"storical epic set in 18th-century Kazakhstan, where a young man is destined to unite the country's three warring tribes.","Sergei Bodrov, Ivan Passer ","Kuno Becker, Jason Scott Lee, Jay Hernandez, Doskhan Zholzhaksynov",3816,$0.08M
165,166,Kandagar,2010,103 min,"Action, Drama, War            ",6.7,"d on the true story of five Russian pilots captured by the Taliban. They are forced to spend three-hundred-seventy-eight days in hell, while facing questions of loyalty, survival and planing their treacherous escape route home.",Andrey Kavun ,"Aleksandr Baluev, Yury Belyayev, Bogdan Benyuk, Aleksandr Golubev",1983,
166,167,Turetskiy gambit,2005,208 min,"Action, Drama, Mystery            ",7,"film is based on the second book from the Adventures of Erast Petrovich Fandorin series of novels written by the Russian author Boris Akunin. The film takes place in 1877 during the ...                See full summary »
",Dzhanik Fayziev ,"Egor Beroev, Olga Krasko, Marat Basharov, Vladimir Ilin",4404,
167,168,Coriolanus,2011,123 min,"Drama, Thriller, War            ",6.1,nished hero of Rome allies with a sworn enemy to take his revenge on the city.,Ralph Fiennes ,"Ralph Fiennes, Gerard Butler, Brian Cox, Lubna Azabal",31680,$0.76M
168,169,Le puits,2015,96 min,Drama            ,7.8,"during the Algerian War of Independence. In the film, the French army surrounds a southern Algerian village where they believe an enemy is being hidden and force the inhabitants to either confront the issue or die of thirst.",Lotfi Bouchouchi ,"Nadia Kaci, Laurent Maurel, Layla Metssitane, Ourais Achour",427,
169,170,Che: Part Two,2008,135 min,"Biography, Drama, History            ",6.9,"967, Ernesto 'Che' Guevara leads a small partisan army to fight an ill-fated revolutionary guerrilla war in Bolivia, South America.",Steven Soderbergh ,"Demián Bichir, Rodrigo Santoro, Benicio Del Toro, Catalina Sandino Moreno",33055,
170,171,The Wall,II) ,88 min,"Action, Drama, Thriller            ",6.2,"American Soldiers are trapped by a lethal sniper, with only an unsteady wall between them.",Doug Liman ,"Aaron Taylor-Johnson, John Cena, Laith Nakli",25606,$1.80M
171,172,Megan Leavey,2017,116 min,"Action, Biography, Drama            ",7.1,d on the true life story of a young Marine corporal whose unique discipline and bond with her military combat dog saved many lives during their deployment in Iraq.,Gabriela Cowperthwaite ,"Kate Mara, Ramon Rodriguez, Tom Felton, Bradley Whitford",22703,$13.41M
172,173,Last Flag Flying,2017,125 min,"Comedy, Drama, War            ",6.9,"ty years after they served together in Vietnam, a former Navy Corpsman Larry ""Doc"" Shepherd re-unites with his old buddies, former Marines Sal Nealon and Reverend Richard Mueller, to bury his son, a young Marine killed in the Iraq War.",Richard Linklater ,"Bryan Cranston, Laurence Fishburne, Steve Carell, J. Quinton Johnson",24224,$0.97M
173,174,American Sniper,2014,133 min,"Action, Biography, Drama            ",7.3," S.E.A.L. sniper Chris Kyle's pinpoint accuracy saves countless lives on the battlefield and turns him into a legend. Back home with his family after four tours of duty, however, Chris finds that it is the war he can't leave behind.",Clint Eastwood ,"Bradley Cooper, Sienna Miller, Kyle Gallner, Cole Konis",456164,$350.13M
174,175,Journey's End,I) (,107 min,"Drama, War            ",6.7,"in a dugout in Aisne in 1918, it is the story of a group of British officers, led by the mentally disintegrating young officer Stanhope, as they await their fate.",Saul Dibb ,"Paul Bettany, Sam Claflin, Stephen Graham, Tom Sturridge",8867,$0.16M
175,176,Whiskey Tango Foxtrot,2016,112 min,"Biography, Comedy, Drama            ",6.6,urnalist recounts her wartime coverage in Afghanistan.,"Glenn Ficarra, John Requa ","Tina Fey, Margot Robbie, Martin Freeman, Alfred Molina",51284,$23.05M
176,177,Pan's Labyrinth,2006,118 min,"Drama, Fantasy, War            ",8.2,"he Falangist Spain of 1944, the bookish young stepdaughter of a sadistic army officer escapes into an eerie but captivating fantasy world.",Guillermo del Toro ,"Ivana Baquero, Ariadna Gil, Sergi López, Maribel Verdú",637080,$37.63M
177,178,Sophie Scholl - Die letzten Tage,2005,120 min,"Biography, Crime, Drama            ",7.6,"amatization of the final days of Sophie Scholl, one of the most famous members of the German World War II anti-Nazi resistance movement, The White Rose.",Marc Rothemund ,"Julia Jentsch, Fabian Hinrichs, Alexander Held, Johanna Gastdorf",27140,$0.68M
178,179,Tobruk,2008,102 min,"History, War            ",5.9,in the Libyan Desert in WW2 a battalion of Czech soldiers face the siege of Tobruk.,Václav Marhoul ,"Jan Meduna, Petr Vanek, Robert Nebrenský, Michal Novotný",1076,
179,180,The Long Road Home,2017,60 min,"Action, Biography, Drama            ",7.5,ican forces occupying Iraq are ambushed in a Baghdad neighborhood.,,"Michael Kelly, Jason Ritter, Kate Bosworth, E.J. Bonilla",2783,
180,181,Yeonpyeong haejeon,2015,130 min,"Drama, War            ",6.6,movies follows the incident known as the second battle of Yeonpyeong which happened in 2002.,Hak-sun Kim ,"Mu-Yeol Kim, Jin Goo, Hyun-Woo Lee, Kim Dong-Hee",1091,$0.32M
181,182,Hyena Road,2015,120 min,"Action, Drama, War            ",6.5,"e different men, three different worlds, three different wars - all stand at the intersection of modern warfare - a murky world of fluid morality where all is not as it seems.",Paul Gross ,"Rossif Sutherland, Allan Hawco, David Richmond-Peck, Karl Campbell",7455,$0.00M
182,183,The Yellow Birds,2017,94 min,"Drama, War            ",5.7,"young soldiers, Bartle (21) and Murph (18) navigate the terrors of the Iraq war under the command of the older, troubled Sergeant Sterling. All the while, Bartle is tortured by a promise he made to Murph's mother before their deployment.",Alexandre Moors ,"Alden Ehrenreich, Daniel Jose Molina, Mikey Collins, Tye Sheridan",3554,
183,184,City 44,2014,130 min,"Drama, History, Romance            ",6.6,"ory of love, friendship and the pursuit of adventure during the bloody and brutal reality of the 1944 Warsaw Uprising.",Jan Komasa ,"Józef Pawlowski, Zofia Wichlacz, Anna Próchniak, Antoni Królikowski",5667,
184,185,Kamienie na szaniec,2014,111 min,"Drama, War            ",6.2,"d on a well-known Polish novel with the same title the movie re-tells a true life story of a group of scouts called ''Szare Szeregi'' (Gray Ranks) during the Nazi occupation of Warsaw ...                See full summary »
",Robert Glinski ,"Tomasz Zietek, Marcel Sabat, Kamil Szeptycki, Magdalena Kolesnik",1193,
185,186,The Last Samurai,2003,154 min,"Action, Drama            ",7.7,merican military advisor embraces the Samurai culture he was hired to destroy after he is captured in battle.,Edward Zwick ,"Tom Cruise, Ken Watanabe, Billy Connolly, William Atherton",414115,$111.11M
186,187,K-19: The Widowmaker,2002,138 min,"Drama, History, Thriller            ",6.7," Russia's first nuclear submarine malfunctions on its maiden voyage, the crew must race to save the ship and prevent a nuclear disaster.",Kathryn Bigelow ,"Harrison Ford, Sam Spruell, Peter Stebbings, Christian Camargo",61415,$35.17M
187,188,Enigma,2001,119 min,"Drama, Mystery, Romance            ",6.4,ung genius frantically races against time to crack an enemy code and solve the mystery surrounding the woman he loves.,Michael Apted ,"Dougray Scott, Kate Winslet, Saffron Burrows, Jeremy Northam",20608,$4.30M
188,189,Rules of Engagement,2000,128 min,"Drama, Thriller, War            ",6.4,ttorney defends an officer on trial for ordering his troops to fire on civilians after they stormed a U.S. embassy in a Middle Eastern country.,William Friedkin ,"Tommy Lee Jones, Samuel L. Jackson, Guy Pearce, Ben Kingsley",45992,$61.34M
189,190,Lions for Lambs,2007,92 min,"Crime, Drama, Mystery            ",6.2,"ries sustained by two Army rangers behind enemy lines in Afghanistan set off a sequence of events involving a congressman, a journalist and a professor.",Robert Redford ,"Tom Cruise, Meryl Streep, Robert Redford, Michael Peña",48714,$15.00M
190,191,The Great Raid,2005,132 min,"Action, Drama, War            ",6.7,"ng place towards the end of WWII, 500 American Soldiers have been entrapped in a camp for 3 years. Beginning to give up hope they will ever be rescued, a group of Rangers goes on a dangerous mission to try and save them.",John Dahl ,"Benjamin Bratt, Joseph Fiennes, James Franco, Robert Mammone",21585,$10.17M
191,192,Age of Heroes,2011,90 min,"Action, Adventure, Drama            ",5.6,"true story of the formation of Ian Fleming's 30 Commando unit, a precursor for the elite forces in the U.K.",Adrian Vitoria ,"Sean Bean, Danny Dyer, Aksel Hennie, Izabella Miko",9675,
192,193,Battle for Haditha,2007,97 min,"Drama, History, War            ",6.9,"nvestigation of the massacre of 24 men, women and children in Haditha, Iraq allegedly shot by 4 U.S. Marines in retaliation for the death of a U.S. Marine killed by a roadside bomb. The movie follows the story of the Marines of Kilo Company, an Iraqi family, and the insurgents who plant the roadside bomb.",Nick Broomfield ,"Matthew Knoll, Elliot Ruiz, Eric Mehalacopoulos, Nathan De La Cruz",7324,$0.01M
193,194,Ali and Nino,2016,100 min,"Drama, Romance, War            ",7, story of a Muslim Azerbaijani boy and Christian Georgian girl in Baku from 1918 to 1920.,Asif Kapadia ,"Adam Bakri, María Valverde, Mandy Patinkin, Riccardo Scamarcio",5041,
194,195,La mula,2013,100 min,"Comedy, Drama            ",5.8,ldier protects a mule during the Spanish Civil War. Based on the novel by Juan Eslava Galan.,"Michael Radford, Sebastien Grousset ","Mario Casas, María Valverde, Antonio Gil, Daniel Grao",775,
195,196,Cinco de Mayo: La batalla,2013,125 min,"Drama, History, War            ",6.2,"ay 5th, 1862, a few thousand Mexican soldiers put their lives on the line against the world's largest and most powerful army in one legendary battle for freedom and for Mexico.",Rafa Lara ,"Christian Vazquez, Angélica Aragón, Liz Gallardo, Kuno Becker",878,$0.17M
196,197,Voces inocentes,2004,120 min,"Drama, Thriller, War            ",7.9,"ung boy, in an effort to have a normal childhood in 1980's El Salvador, is caught up in a dramatic fight for his life as he desperately tries to avoid the war which is raging all around him.",Luis Mandoki ,"Carlos Padilla, Leonor Varela, Xuna Primus, Gustavo Muñoz",7506,$0.84M
197,198,Geroy,2016,76 min,"Action, Drama, Romance            ",4.6,"ey goes to Paris to visit the grave of his great-grandfather, who had been an officer in the White Army. On the headstone of the next grave, he notices the face of a young woman. He will see this face again.",Yuriy Vasilev ,"Aleksandr Adabashyan, Aleksandr Baluev, Marat Basharov, Dima Bilan",433,
198,199,Hannibal,2006,89 min,"Action, Biography, Drama            ",6.8,"s 200 years before the birth of Christ and Rome is the new superpower of the ancient world. She believes she is invincible - but one man is destined to change that. He is a man bound by...                See full summary »
",Edward Bazalgette ,"Alexander Siddig, Emilio Doorgasingh, Bashar Rahal, Mido Hamada",1627,
199,200,Thank You for Your Service,I) (,109 min,"Biography, Drama, War            ",6.6,"oup of U.S. soldiers returning from Iraq struggle to integrate back into family and civilian life, while living with the memory of a war that threatens to destroy them long after they've left the battlefield.",Jason Hall ,"Miles Teller, Beulah Koale, Joe Cole, Scott Haze",13206,$9.47M
200,201,Bridge of Spies,2015,142 min,"Drama, History, Thriller            ",7.6,"ng the Cold War, an American lawyer is recruited to defend an arrested Soviet spy in court, and then help the CIA facilitate an exchange of the spy for the Soviet captured American U2 spy plane pilot, Francis Gary Powers.",Steven Spielberg ,"Tom Hanks, Mark Rylance, Alan Alda, Amy Ryan",298237,$72.31M
201,202,Kajaki,2014,108 min,"Adventure, Biography, Drama            ",7.1,"ki Dam 2006. A company of young British soldiers encounter an unexpected, terrifying enemy. A dried-out river bed, and under every step the possibility of an anti-personnel mine. A mine that could cost you your leg - or your life.",Paul Katis ,"David Elliot, Mark Stanley, Scott Kyle, Benjamin O'Mahony",12725,
202,203,13 Hours,2016,144 min,"Action, Drama, Thriller            ",7.3,"ng an attack on a U.S. compound in Libya, a security team struggles to make sense out of the chaos.",Michael Bay ,"John Krasinski, Pablo Schreiber, James Badge Dale, David Denman",128537,$52.85M
203,204,Passchendaele,2008,114 min,"Drama, History, Romance            ",6.4,"lives of a troubled veteran, his nurse girlfriend and a naive boy intersect first in Alberta and then in Belgium during the bloody World War I battle of Passchendaele.",Paul Gross ,"Paul Gross, Michael Greyeyes, James Kot, Jesse Frechette",8192,
204,205,Kokoda,2006,92 min,"Action, Drama, War            ",6.1,tter battle is fought between Australian and Japanese soldiers along the Kokoda trail in New Guinea during World War II.,Alister Grierson ,"Jack Finsterer, Travis McMahon, Simon Stone, Luke Ford",2925,
205,206,Leningrad,2009,110 min,"Drama, War            ",6.1,"er, 1941. World War II rages on as Nazi troops invade the Soviet Union and besiege the devastated city of Leningrad. Foreign journalists are quickly evacuated, but in the chaos that ensues, Kate Davies is left behind.",Aleksandr Buravskiy ,"Mira Sorvino, Armin Mueller-Stahl, Olga Sutulova, Gabriel Byrne",4555,
206,207,Zvezda,2002,97 min,"Action, Adventure, Drama            ",7.1,"ng WW2 the Russian Army sent a special group named ""Zvezda"" to fight the Nazis in their backyard.",Nikolay Lebedev ,"Igor Petrenko, Artyom Semakin, Aleksey Panin, Aleksey Kravchenko",2487,
207,208,Vilniaus getas,2005,110 min,"History, War            ",6.8,"942, in Vilnius, the Nazi annihilate 55,000 Jews and squeeze the 15,000 survivors in a seven blocks ghetto. The twenty-two year old sadistic commander Kittel is assigned to administrate...                See full summary »
",Audrius Juzenas ,"Heino Ferch, Sebastian Hülk, Erika Marozsán, Andrius Zebrauskas",1270,
208,209,Tadas Blinda. Pradzia,2011,106 min,"Adventure, Drama, History            ",7.1,mance blooms between a noblewoman and a common man amid a peasant revolt against the brutal Russian army,Donatas Ulvydas ,"Mantas Jankavicius, Agniya Ditkovskite, Tatyana Lyutaeva, Vidas Petkevicius",3001,
209,210,Riphagen,2016,131 min,"Biography, Drama, War            ",7.1,"story about Riphagen, a cunning Dutch traitor during WW2 who helped Nazi round up Jews, stealing their treasures for himself. He destroyed Resistance groups, making many who pursued justice after the war look like fools.",Pieter Kuijpers ,"Huub Smit, Jeroen van Koningsbrugge, Anna Raadsveld, Sigrid ten Napel",7127,
210,211,Pohwasogeuro,2010,120 min,"Action, Drama, War            ",7.3,story of student-soldiers trying to protect a middle school during the early days of the Korean War.,John H. Lee ,"Seung-Won Cha, Sang-Woo Kwon, Seung-Hyun Choi, Seung-woo Kim",5292,
211,212,Gukjesijang,2014,126 min,"Drama, War            ",7.9," the time of Korean War, a young boy's vow to take care of his family marked the beginning of a lifelong promise spanning 60 years.",JK Youn ,"Jung-min Hwang, Yunjin Kim, Dal-su Oh, Jin-young Jung",4748,$2.30M
212,213,Gongdong gyeongbi guyeok JSA,2000,110 min,"Action, Drama, Thriller            ",7.8,"r a shooting incident at the North/South Korean border/DMZ leaves 2 North Korean soldiers dead, a neutral Swiss/Swedish team investigates, what actually happened.",Park Chan-Wook ,"Lee Yeong-ae, Lee Byung-hun, Kang-ho Song, Kim Tae-Woo",28202,
213,214,The Reader,2008,124 min,"Drama, Romance            ",7.6,"-WWII Germany: Nearly a decade after his affair with an older woman came to a mysterious end, law student Michael Berg re-encounters his former lover as she defends herself in a war-crime trial.",Stephen Daldry ,"Kate Winslet, Ralph Fiennes, Bruno Ganz, Jeanette Hain",235711,$34.19M
214,215,Saul fia,2015,107 min,"Drama, War            ",7.5,wish-Hungarian concentration camp prisoner sets out to give a child he mistook for his son a proper burial.,László Nemes ,"Géza Röhrig, Levente Molnár, Urs Rechn, Todd Charmont",46871,$1.78M
215,216,Conspiracy,2001,96 min,"Biography, Drama, History            ",7.7,"he Wannsee Conference on January 20, 1942, senior Nazi officials meet to determine the manner in which the so-called ""Final Solution to the Jewish Question"" can be best implemented.",Frank Pierson ,"Kenneth Branagh, Clare Bullus, Stanley Tucci, Simon Markey",20013,
216,217,Phoenix,II) ,98 min,"Drama, History, Music            ",7.3,sfigured Holocaust survivor sets out to determine if the man she loved betrayed her trust.,Christian Petzold ,"Nina Hoss, Ronald Zehrfeld, Nina Kunzendorf, Trystan Pütter",17835,
217,218,Storming Juno,2010,88 min,"History, War            ",6.7,"drama retelling the Canadian assault of Juno Beach on D-Day, as told via reenactment and through interviews with those who were there.",Tim Wolochatiuk ,"Benjamin Muir, Kevin Walker, Craig Cyr, Anthony Rella",630,
218,219,Tmavomodrý svet,2001,112 min,"War, Drama, Action            ",7.2,friendship of two men becomes tested when they both fall for the same woman.,Jan Sverák ,"Ondrej Vetchý, Krystof Hádek, Tara Fitzgerald, Charles Dance",5707,$0.26M
219,220,Mein bester Feind,2011,109 min,"Comedy, Drama, War            ",6.7,"rk WWII comedy about two friends, stolen artwork and an unfortunate case of mistaken identities, as a Jewish man switches places with his Nazi best friend in order to survive",Wolfgang Murnberger ,"Moritz Bleibtreu, Georg Friedrich, Ursula Strauss, Marthe Keller",1475,
220,221,Un secret,2007,105 min,"Drama, War            ",6.8,-year-old boy unearths a shocking family secret.,Claude Miller ,"Cécile de France, Patrick Bruel, Ludivine Sagnier, Julie Depardieu",3062,$0.62M
221,222,Max,I) (,106 min,"Drama, War            ",6.5,"lm studying the depiction of a friendship between an art dealer named Rothman and his student, Adolf Hitler.",Menno Meyjes ,"John Cusack, Noah Taylor, Leelee Sobieski, Molly Parker",8453,$0.53M
222,223,Churchill,2017,105 min,"Biography, Drama, History            ",6.1,"ty-six hours before the World War II invasion of Normandy, British Prime Minister Winston Churchill struggles with his severe reservations with Operation Overlord and his increasingly marginalized role in the war effort.",Jonathan Teplitzky ,"Brian Cox, Miranda Richardson, John Slattery, Julian Wadham",16538,$1.28M
223,224,Lincoln,2012,150 min,"Biography, Drama, History            ",7.3,"he American Civil War continues to rage, America's president struggles with continuing carnage on the battlefield as he fights with many inside his own cabinet on the decision to emancipate the slaves.",Steven Spielberg ,"Daniel Day-Lewis, Sally Field, David Strathairn, Joseph Gordon-Levitt",251598,$182.21M
224,225,Alexander,2004,175 min,"Action, Biography, Drama            ",5.6,"ander, the King of Macedonia and one of the greatest army leaders in the history of warfare, conquers much of the known world.",Oliver Stone ,"Colin Farrell, Anthony Hopkins, Rosario Dawson, Angelina Jolie",165805,$34.30M
225,226,Sand Castle,2017,113 min,"Action, Drama, War            ",6.3,"story follows a young soldier, and his introduction into the 2003 invasion of Iraq. Based on true events, it bears witness to the destruction, and horrors of war.",Fernando Coimbra ,"Nicholas Hoult, Logan Marshall-Green, Henry Cavill, Glen Powell",21398,
226,227,Billy Lynn's Long Halftime Walk,2016,113 min,"Action, Drama, Sport            ",6.2,"ear-old Billy Lynn is brought home for a victory tour after a harrowing Iraq battle. Through flashbacks, the film shows what really happened to his squad - contrasting the realities of war with America's perceptions.",Ang Lee ,"Joe Alwyn, Garrett Hedlund, Arturo Castro, Mason Lee",21916,$1.72M
227,228,Die Fälscher,2007,99 min,"Crime, Drama, History            ",7.6,"story of the Operation Bernhard, the largest counterfeiting operation in history, carried out by Germany during WWII.",Stefan Ruzowitzky ,"Karl Markovics, August Diehl, Devid Striesow, Martin Brambach",44524,$5.48M
228,229,Anonyma - Eine Frau in Berlin,2008,131 min,"Biography, Drama, History            ",7.1,man tries to survive the invasion of Berlin by the Soviet troops during the last days of World War II.,Max Färberböck ,"Nina Hoss, Evgeniy Sidikhin, Irm Hermann, Rüdiger Vogler",6328,$0.29M
229,230,Die Flucht,2007,180 min,"Drama, History, Thriller            ",6.5,"944 many Germans in Eastern Prussia believed like Lena von Mahlenberg, daughter of a local aristocrat, that Hitler would surrender and spare them from being invaded by the vengeful Russian Red Army. He didn't and they had to flee.",Kai Wessel ,"Maria Furtwängler, Jean-Yves Berteloot, Tonio Arango, Gabriela Maria Schmeide",573,
