,id,name,year,run_time,genre,rating,about,director,actors,votes,gross
78,79,The Wind that Shakes the Barley,2006,127 min,"Drama, War            ",7.5,"nst the backdrop of the Irish War of Independence, two brothers fight a guerrilla war against British forces.",Ken Loach ,"Cillian Murphy, Pádraic Delaney, Liam Cunningham, Orla Fitzgerald",48532,$1.83M
79,80,Green Zone,2010,115 min,"Action, Drama, Thriller            ",6.8,overing covert and faulty intelligence causes a U.S. Army officer to go rogue as he hunts for Weapons of Mass Destruction in an unstable region.,Paul Greengrass ,"Matt Damon, Jason Isaacs, Greg Kinnear, Igal Naor",134079,$35.05M
80,81,Master and Commander: The Far Side of the World,2003,138 min,"Action, Adventure, Drama            ",7.4,"ng the Napoleonic Wars, a brash British captain pushes his ship and crew to their limits in pursuit of a formidable French war vessel around South America.",Peter Weir ,"Russell Crowe, Paul Bettany, Billy Boyd, James D'Arcy",210742,$93.93M
81,82,Zero Dark Thirty,2012,157 min,"Drama, History, Thriller            ",7.4,"ronicle of the decade-long hunt for al-Qaeda terrorist leader Osama bin Laden after the September 2001 attacks, and his death at the hands of the Navy S.E.A.L.s Team 6 in May 2011.",Kathryn Bigelow ,"Jessica Chastain, Joel Edgerton, Chris Pratt, Mark Strong",283349,$95.72M
82,83,Miracle at St. Anna,2008,160 min,"Action, Drama, War            ",6.1,"in 1944 Italy, the story of four black American soldiers who get trapped in a Tuscan village during WWII.",Spike Lee ,"Derek Luke, Michael Ealy, Laz Alonso, Omar Benson Miller",18371,$7.92M
83,84,John Rabe,2009,134 min,"Biography, Drama, History            ",7.2,"ue-story account of a German businessman who saved more than 200,000 Chinese during the Nanjing massacre in 1937-38.",Florian Gallenberger ,"Ulrich Tukur, Daniel Brühl, Steve Buscemi, Anne Consigny",6315,$0.07M
84,85,Saints and Soldiers,2003,90 min,"Action, Drama, War            ",6.7, American soldiers and one Brit fighting in Europe during World War II struggle to return to Allied territory after being separated from U.S. forces during the historic Malmedy Massacre.,Ryan Little ,"Corbin Allred, Alexander Polinsky, Kirby Heyborne, Larry Bagby",20385,$1.31M
85,86,HHhH,2017,120 min,"Action, Biography, Thriller            ",6.4,"he German Fascists expand their borders, scorching Europe from end to end, two brave Czechs of the Resistance prepare for a suicide mission to assassinate Reinhard Heydrich, the hideous mastermind behind the ""Final Solution"".",Cédric Jimenez ,"Jason Clarke, Rosamund Pike, Jack O'Connell, Jack Reynor",15454,
86,87,Wonder Woman,2017,141 min,"Action, Adventure, Fantasy            ",7.4," a pilot crashes and tells of conflict in the outside world, Diana, an Amazonian warrior in training, leaves home to fight a war, discovering her full powers and true destiny.",Patty Jenkins ,"Gal Gadot, Chris Pine, Robin Wright, Lucy Davis",608750,$412.56M
87,88,Habermann,2010,104 min,"Drama, Romance, War            ",7,ll owner in the Sudetenland and his family's lives are changed as Europe heats up in 1938.,Juraj Herz ,"Mark Waschke, Karel Roden, Ben Becker, Hannah Herzsprung",1125,
88,89,Australia,2008,165 min,"Adventure, Comedy, Drama            ",6.6,"in northern Australia before World War II, an English aristocrat who inherits a sprawling ranch reluctantly pacts with a stock-man in order to protect her new property from a takeover plot. As the pair drive 2,000 head of cattle over unforgiving landscape, they experience the bombing of Darwin, Australia, by Japanese forces firsthand.",Baz Luhrmann ,"Nicole Kidman, Hugh Jackman, Shea Adams, Eddie Baroo",121575,$49.55M
89,90,Elser,2015,114 min,"Biography, Drama, War            ",7,"ovember 1939, Georg Elser's attempt to assassinate Adolf Hitler fails, and he is arrested. During his confinement, he recalls the events leading up to his plot and his reasons for deciding to take such drastic action.",Oliver Hirschbiegel ,"Christian Friedel, Katharina Schüttler, Burghart Klaußner, Johann von Bülow",8821,$0.16M
90,91,Belyy tigr,2012,104 min,"Action, Adventure, Fantasy            ",6.1,"t Patriotic War, early 1940s. After barely surviving a battle with a mysterious, ghostly-white Tiger tank, Red Army Sergeant Ivan Naydenov becomes obsessed with its destruction.",Karen Shakhnazarov ,"Aleksey Vertkov, Vitaliy Kishchenko, Valeriy Grishko, Dmitriy Bykovskiy-Romashov",3999,
91,92,Les femmes de l'ombre,2008,148 min,"Drama, War            ",6.8,"on, 1944: SOE's section for French ops parachute 4 women into France, plus a woman there, to free an English geologist and kill SS colonel Heindrich.",Jean-Paul Salomé ,"Sophie Marceau, Julie Depardieu, Moritz Bleibtreu, Marie Gillain",7209,
92,93,Dvadtsat vosem panfilovtsev,2016,121 min,"Action, Drama, History            ",6.8,"ovember 1941, remaining squad of Soviet soldiers must stop a column of Nazi Germany tanks.","Kim Druzhinin, Andrey Shalopa ","Maksim Abrosimov, Sergey Agafonov, Pavel Aseev, Ivan Batarev",5108,
93,94,V tumane,2012,127 min,"Drama, History, War            ",6.8,"ern frontiers of the USSR, 1942. The region is under German occupation. A man is wrongly accused of collaboration. Desperate to save his dignity, he faces impossible moral choice.",Sergey Loznitsa ,"Vladimir Svirskiy, Vladislav Abashin, Sergey Kolesov, Nikita Peremotov",3057,$0.01M
94,95,Pop,2009,130 min,"Drama, History, War            ",7,er Alexander is trying to maintain peaceful life for his church amidst the Nazi occupation during WWII.,Vladimir Khotinenko ,"Sergey Makovetskiy, Nina Usatova, Elizaveta Arzamasova, Kirill Pletnyov",1238,
95,96,Batalion,2015,120 min,"Action, Drama, History            ",6.5,"ia, 1917, WWI. This is the story of the 1st Russian Women's Battalion of Death, formed as part of an ill-conceived propaganda ploy by the Russian Provisional Government in late May of 1917.",Dmitriy Meskhiev ,"Lesya Andreeva, Mariya Antonova, Mariya Aronova, Nikolay Auzin",1476,
96,97,Beneath Hill 60,2010,122 min,"Drama, History, War            ",7.1,"916, the 1st Australian Tunnelling Company is tunneling beneath German fortifications and bunkers to detonate massive explosive charges.",Jeremy Sims ,"Brendan Cowell, Harrison Gilbertson, Steve Le Marquand, Gyton Grantley",7885,
97,98,Rambo,2008,92 min,"Action, Thriller            ",7,"hailand, John Rambo joins a group of mercenaries to venture into war-torn Burma, and rescue a group of Christian aid workers who were kidnapped by the ruthless local infantry unit.",Sylvester Stallone ,"Sylvester Stallone, Julie Benz, Matthew Marsden, Graham McTavish",223752,$42.75M
98,99,Child 44,2015,137 min,"Crime, Drama, History            ",6.5,sgraced member of the Russian military police investigates a series of child murders during the Stalin-era Soviet Union.,Daniel Espinosa ,"Tom Hardy, Gary Oldman, Noomi Rapace, Joel Kinnaman",68391,$1.21M
99,100,Little Boy,2015,106 min,"Drama, History, War            ",7.4,ight-year-old boy is willing to do whatever it takes to end World War II so he can bring his father home. The story reveals the indescribable love a father has for his little boy and the love a son has for his father.,Alejandro Monteverde ,"Jakob Salvati, Emily Watson, David Henrie, Michael Rapaport",22616,$6.42M
100,101,First They Killed My Father,2017,136 min,"Biography, Drama, History            ",7.2,odian author and human rights activist Loung Ung recounts the horrors she suffered as a child under the rule of the deadly Khmer Rouge.,Angelina Jolie ,"Sareum Srey Moch, Phoeung Kompheak, Sveng Socheata, Mun Kimhak",17134,
101,102,The Siege of Jadotville,2016,108 min,"Action, Drama, History            ",7.2,h Commandant Pat Quinlan leads a stand off with troops against French and Belgian Mercenaries in the Congo during the early 1960s.,Richie Smyth ,"Richard Lukunku, Danny Sapani, Andrew Stock, Mark Strong",35822,
102,103,Mil-jeong,2016,140 min,"Action, Drama, Thriller            ",7.1,an resistance fighters smuggle explosives to destroy facilities controlled by Japanese forces in this period action thriller.,Jee-woon Kim ,"Lee Byung-hun, Kang-ho Song, Zach Aguilar, Gong Yoo",9192,$0.54M
103,104,Incheon sangryuk jakjeon,2016,111 min,"Action, Drama, History            ",6.2,am of spies is sent into Incheon to gain intelligence on North Korean positions ahead of the invasion by UN forces.,John H. Lee ,"Liam Neeson, Jung-jae Lee, Beom-su Lee, Se-Yeon Jin",5245,$1.02M
104,105,'71,2014,99 min,"Action, Crime, Drama            ",7.2,"971, a young and disoriented British soldier is accidentally abandoned by his unit following a riot on the deadly streets of Belfast.",Yann Demange ,"Jack O'Connell, Sam Reid, Sean Harris, Paul Popplewell",53533,$1.27M
105,106,The Ottoman Lieutenant,2017,106 min,"Drama, War            ",6.5, movie is a love story between an idealistic American nurse and a Turkish officer in World War I.,Joseph Ruben ,"Michiel Huisman, Hera Hilmar, Josh Hartnett, Ben Kingsley",25124,
106,107,The Promise,II) ,133 min,"Action, Adventure, Drama            ",6,"during the last days of the Ottoman Empire, The Promise follows a love triangle between Michael, a brilliant medical student, the beautiful and sophisticated Ana, and Chris - a renowned American journalist based in Paris.",Terry George ,"Oscar Isaac, Charlotte Le Bon, Christian Bale, Daniel Giménez Cacho",174595,
107,108,La rafle,2010,115 min,"Drama, History, War            ",7.1,"ithful retelling of the 1942 ""Vel' d'Hiv Roundup"" and the events surrounding it.",Rose Bosch ,"Jean Reno, Mélanie Laurent, Gad Elmaleh, Raphaëlle Agogué",8558,
108,109,Tears of the Sun,2003,121 min,"Action, Drama, Thriller            ",6.6,ecial-Ops commander leads his team into the Nigerian jungle in order to rescue a doctor who will only join them if they agree to save 70 refugees too.,Antoine Fuqua ,"Bruce Willis, Cole Hauser, Monica Bellucci, Eamonn Walker",116995,$43.73M
109,110,Oorlogswinter,2008,103 min,"Drama, History, War            ",7,"he Nazi-occupied Netherlands, a teenage boy gets involved in the Dutch Resistance after coming to the aid of a wounded RAF pilot.",Martin Koolhoven ,"Martijn Lakemeier, Jamie Campbell Bower, Yorick van Wageningen, Raymond Thiry",12560,$0.54M
110,111,For Greater Glory: The True Story of Cristiada,2012,145 min,"Drama, History, War            ",6.6,ronicle of the Cristeros War (1926-1929); a war by the people of Mexico against the atheistic Mexican government.,Dean Wright ,"Andy Garcia, Oscar Isaac, Catalina Sandino Moreno, Santiago Cabrera",4795,$5.67M
111,112,Free State of Jones,2016,139 min,"Action, Biography, Drama            ",6.9,sillusioned Confederate army deserter returns to Mississippi and leads a militia of fellow deserters and women in an uprising against the corrupt local Confederate government.,Gary Ross ,"Matthew McConaughey, Gugu Mbatha-Raw, Mahershala Ali, Keri Russell",55381,$20.76M
112,113,Kingdom of Heaven,2005,144 min,"Action, Adventure, Drama            ",7.2,"an of Ibelin travels to Jerusalem during the Crusades of the 12th century, and there he finds himself as the defender of the city and its people.",Ridley Scott ,"Orlando Bloom, Eva Green, Liam Neeson, Martin Hancock",274663,$47.40M
113,114,Tau ming chong,2007,126 min,"Action, Adventure, Drama            ",7,"a, 1860s: Having his army slaughtered, General Qingyun joins 2 bandit leaders in raids on rebels and in blood oath. They form a Qing loyal army with eyes on rebel held Suzhou and Nanjing.","Peter Ho-Sun Chan, Wai-Man Yip ","Jet Li, Andy Lau, Takeshi Kaneshiro, Jinglei Xu",26352,$0.13M
114,115,Katyn,2007,122 min,"Drama, History, War            ",7,xamination of the Soviet slaughter of thousands of Polish officers and citizens in the Katyn forest in 1940.,Andrzej Wajda ,"Andrzej Chyra, Maja Ostaszewska, Artur Zmijewski, Danuta Stenka",16057,$0.12M
115,116,In Darkness,2011,145 min,"Drama, War            ",7.3,amatization of one man's rescue of Jewish refugees in the German-occupied Polish city of Lvov.,Agnieszka Holland ,"Robert Wieckiewicz, Benno Fürmann, Agnieszka Grochowska, Maria Schrader",10391,$1.04M
116,117,Libertador,2013,119 min,"Biography, Drama, History            ",6.8,"n Bolivar fought over 100 battles against the Spanish Empire in South America. He rode over 70,000 miles on horseback. His military campaigns covered twice the territory of Alexander the Great. His army never conquered -- it liberated.",Alberto Arvelo ,"Edgar Ramírez, Erich Wildpret, María Valverde, Juana Acosta",5215,$0.11M
117,118,Povodyr,2014,122 min,"Drama, History            ",7.8,ican boy Peter and blind minstrel Ivan are thrown together by fate amidst the turbulent mid-1930s Soviet Ukraine.,Oles Sanin ,"Stanislav Boklan, Jeff Burrell, Anton Sviatoslav Greene, Andriy Haddad",2822,
118,119,Xin hai ge ming,2011,99 min,"Drama, History, War            ",5.8,storical drama based on the founding of the Republic of China when nationalist forces led by Sun Yat-sen overthrew the Qing Dynasty.,"Tao Hai, Wei Li, Guoqiang Tang, Li Zhang, Jackie Chan ","Jackie Chan, Winston Chao, Bingbing Li, Chun Sun",6075,$0.13M
119,120,Khaytarma,2013,89 min,"Drama, History, War            ",7.1,"ory about a tragic date in the history of the Crimean Tatar nation - 18 of may 1944 -Stalin's deportation of the Crimean Tatars. Main character of the film - a pilot, twice Hero of the ...                See full summary »
",Akhtem Seitablaev ,"Dinara Avaz, Aleksey Gorbunov, Usnie Khalilova, Andrey Mostrenko",723,
120,121,The Hurt Locker,2008,131 min,"Drama, Thriller, War            ",7.5,"ng the Iraq War, a Sergeant recently assigned to an army bomb squad is put at odds with his squad mates due to his maverick way of handling his work.",Kathryn Bigelow ,"Jeremy Renner, Anthony Mackie, Brian Geraghty, Guy Pearce",433515,$17.02M
121,122,Forces spéciales,2011,109 min,"Action, Drama, War            ",6.4,ench journalist in Afghanistan is kidnapped by the Taliban.,Stéphane Rybojad ,"Diane Kruger, Djimon Hounsou, Benoît Magimel, Denis Ménochet",18399,$0.01M
122,123,No Man's Land,I) (,98 min,"Comedy, Drama, War            ",7.9,"ia and Herzegovina during 1993 at the time of the heaviest fighting between the two warring sides. Two soldiers from opposing sides in the conflict, Nino and Ciki, become trapped in no man's land, whilst a third soldier becomes a living booby trap.",Danis Tanovic ,"Branko Djuric, Rene Bitorajac, Filip Sovagovic, Georges Siatidis",45988,$1.06M
123,124,War and Peace,2007,394 min,"Drama, History, Romance            ",7.2,story of five aristocratic families in Russia during the Napoleonic Wars of 1812,,"Clémence Poésy, Alessio Boni, Alexander Beyer, Malcolm McDowell",1941,
124,125,Napoléon,2002,380 min,"Adventure, Biography, Drama            ",7.4,"sterful soldier, tactician and statesmen, Napoleon Bonaparte's courage and love for his country sees him rise from an unpaid general consumed with ambition to the most powerful man in Europe, then his fall, and exile",,"Christian Clavier, Isabella Rossellini, Gérard Depardieu, John Malkovich",4304,
125,126,Michiel de Ruyter,2015,151 min,"Action, Adventure, Biography            ",7," the young republic of The Netherlands is attacked by England, France, and Germany, and the country is on the brink of civil war, only one man can lead the country's strongest weapon, the Dutch fleet: Michiel de Ruyter (Frank Lammers).",Roel Reiné ,"Frank Lammers, Sanne Langelaar, Barry Atsma, Lieke van Lexmond",9434,
126,127,1944,2015,100 min,"Drama, History, War            ",7.1,"944 Estonia, a fratricide war ensues when Estonians of the retreating German forces fight against Estonians conscripted into the advancing Soviet Red Army.",Elmo Nüganen ,"Kaspar Velberg, Kristjan Üksküla, Maiken Pius, Gert Raudsep",5286,
127,128,Kon-Tiki,2012,118 min,"Adventure, Biography, Drama            ",7.2,"ndary explorer Thor Heyerdahl's epic 4,300-mile crossing of the Pacific on a balsawood raft in 1947, in an effort to prove that it was possible for South Americans to settle in Polynesia in pre-Columbian times.","Joachim Rønning, Espen Sandberg ","Pål Sverre Hagen, Anders Baasmo Christiansen, Gustaf Skarsgård, Odd-Magnus Williamson",47463,$1.52M
128,129,Dear John,I) (,108 min,"Drama, Mystery, Romance            ",6.3,mantic drama about a soldier who falls for a conservative college student while he's home on leave.,Lasse Hallström ,"Channing Tatum, Amanda Seyfried, Richard Jenkins, Henry Thomas",143107,$80.01M
129,130,Bloody Sunday,2002,107 min,"Drama, History, War            ",7.6,"amatization of the Irish civil rights protest march and subsequent massacre by British troops on January 30, 1972.",Paul Greengrass ,"James Nesbitt, Tim Pigott-Smith, Nicholas Farrell, Allan Gildea",24145,$0.77M
130,131,Jarhead,2005,125 min,"Action, Biography, Drama            ",7,"ychological study of Marine's state of mind during the Gulf War. Told through the eyes of a U.S. Marine sniper who struggles to cope with boredom, a sense of isolation, and other issues back home.",Sam Mendes ,"Jake Gyllenhaal, Jamie Foxx, Lucas Black, Scott MacDonald",180986,$62.66M
131,132,Gods and Generals,2003,219 min,"Biography, Drama, History            ",6.3,"rise and fall of confederate general Thomas ""Stonewall"" Jackson, as he meets with military success against the Union from 1861 to 1863, when he is accidentally killed by his own soldiers.",Ron Maxwell ,"Stephen Lang, Robert Duvall, Jeff Daniels, Donzaleigh Abernathy",15890,$12.87M
132,133,Windtalkers,2002,134 min,"Action, Drama, War            ",6.1,"U.S. Marines in World War II are assigned to protect Navajo Marines, who use their native language as an unbreakable radio cypher.",John Woo ,"Nicolas Cage, Adam Beach, Peter Stormare, Noah Emmerich",67235,$40.91M
133,134,U-571,2000,116 min,"Action, War            ",6.6,rman submarine is boarded by disguised American submariners trying to capture their Enigma cipher machine.,Jonathan Mostow ,"Matthew McConaughey, Bill Paxton, Harvey Keitel, Jon Bon Jovi",80131,$77.09M
134,135,Flags of Our Fathers,2006,135 min,"Action, Adventure, Drama            ",7.1,"life stories of the six men who raised the flag at the Battle of Iwo Jima, a turning point in World War II.",Clint Eastwood ,"Ryan Phillippe, Barry Pepper, Joseph Cross, Jesse Bradford",120256,$33.60M
135,136,Patria,II) ,77 min,"Drama, History, War            ",5.5,"he 1914 summer sun heats up mainland Europe, World War One crashes down across the fractured peninsula. Living in Paris, Dutchman Arthur Knaap yearns to serve, protect and defend his beloved nation and joins the Foreign Legion.",Klaas van Eijkeren ,"Timothy Flohr, Pascal Vugts, Ricardo Esser, Tijs Huys",122,
136,137,USS Indianapolis: Men of Courage,2016,128 min,"Action, Drama, History            ",5.3,"ng World War II, an American navy ship is sunk by a Japanese submarine leaving 890 crewmen stranded in shark infested waters.",Mario Van Peebles ,"Nicolas Cage, Tom Sizemore, Thomas Jane, Matt Lanter",12232,
137,138,Amigo,2010,124 min,"Drama, War            ",5.8,ctional account of events during the Philippine-American War.,John Sayles ,"Joel Torre, Chris Cooper, Garret Dillahunt, Arthur Acuña",607,$0.18M
138,139,Act of Valor,2012,110 min,"Action, Adventure, Thriller            ",6.5,lite team of Navy SEALs embark on a covert mission to recover a kidnapped CIA agent.,"Mike McCoy, Scott Waugh ","Alex Veadov, Roselyn Sanchez, Nestor Serrano, Rorke Denver",67759,$70.01M
139,140,Hart's War,2002,125 min,"Drama, War            ",6.3,"w student becomes a lieutenant during World War II, is captured and asked to defend a black prisoner of war falsely accused of murder.",Gregory Hoblit ,"Bruce Willis, Colin Farrell, Terrence Howard, Cole Hauser",51999,$19.08M
140,141,"Unsere Mütter, unsere Väter",2013,270 min,"Action, Drama, History            ",8.5, friends go out to war and promise each other to be back for Christmas.,,"Volker Bruch, Tom Schilling, Katharina Schüttler, Miriam Stein",27688,$0.09M
141,142,Attila,2001,177 min,"Action, Adventure, Biography            ",6.7,"manced story of Attila the Hun (Gerard Butler), from when he lost his parents in childhood until his death. Attila is disclosed as a great leader, strategist, and lover and the movie ...                See full summary »
",,"Pauline Lynch, Steven Berkoff, Andrew Pleavin, Tommy Flanagan",10380,
142,143,Fetih 1453,2012,162 min,"Action, Drama, History            ",6.6,"r the death of his father Murat II, Mehmet II ascends to the Ottoman throne. After braving internal and external enemies, he decides to complete what he was destined to do - conquer Constantinople.",Faruk Aksoy ,"Devrim Evin, Ibrahim Celikkol, Dilek Serbest, Cengiz Coskun",57396,$0.07M
143,144,Dag,2012,90 min,"Adventure, Drama, Thriller            ",7.8,"heroic story of two soldiers trapped in an ambush, fighting for their lives.",Alper Caglar ,"Caglar Ertugrul, Ufuk Bayraktar, Firat Dogruloglu, Mesut Akusta",20851,
144,145,Dag II,2016,135 min,"Action, Drama, War            ",8.7," desolate war zone where screams of the innocent echo, seven Maroon Berets will dance with death on the very line between disaster and valor.",Alper Caglar ,"Caglar Ertugrul, Ufuk Bayraktar, Ahu Türkpençe, Murat Serezli",106706,
145,146,Çanakkale Yolun Sonu,2013,101 min,"Action, Drama, History            ",7.2,"l, 1915. First World War in Canakkale, Ottoman Empire. Two brothers leave their mountain village to fight on the front line. One is an experienced sniper fighting for Ottomans against ...                See full summary »
","Kemal Uzun, Serdar Akar, Ahmet Karaman ","Gürkan Uygun, Berrak Tüzünataç, Umut Kurt, Stephen Chance",4807,
146,147,Mongol,2007,126 min,"Action, Biography, Drama            ",7.2,story recounts the early life of Genghis Khan who was a slave before going on to conquer half the world in 1206.,Sergei Bodrov ,"Tadanobu Asano, Amadu Mamadakov, Khulan Chuluun, Honglei Sun",45598,$5.70M
147,148,La folle histoire de Max et Léon,2016,98 min,"Comedy, War            ",6.2,"and Léon's adventures, two childhood friends idle and party-goer, who are trying to escape the Second World War.",Jonathan Barré ,"David Marsais, Grégoire Ludig, Alice Vial, Saskia de Melo Dillais",1943,
148,149,Tuntematon sotilas,2017,180 min,"Drama, War            ",7.8,"lm adaptation of Väinö Linna's best selling novel The Unknown Soldier (1954) and the novel's unedited manuscript version, Sotaromaani.",Aku Louhimies ,"Eero Aho, Johannes Holopainen, Jussi Vatanen, Aku Hirviniemi",10261,
149,150,9. april,2015,93 min,"Drama, History, War            ",6.6,"pril 9, 1940 Germany invaded Denmark. Based on real events - in Southern Jutland a military unit on bicycles was sent south to help hold back the Germans until reinforcement.",Roni Ezra ,"Pilou Asbæk, Lars Mikkelsen, Simon Sears, Gustav Dyekjær Giese",5370,
150,151,Ayla: The Daughter of War,2017,125 min,"Biography, Drama, History            ",8.4,"950, amid-st the ravages of the Korean War, Sergeant Süleyman stumbles upon a half-frozen little girl, with no parents and no help in sight. Frantic, scared and on the verge of death, ...                See full summary »
","Can Ulkay, Halenur Uzunoglu ","Çetin Tekindor, Ismail Hacioglu, Kyung-jin Lee, Kim Seol",36881,
151,152,The Four Feathers,2002,132 min,"Action, Adventure, Drama            ",6.5,itish officer resigns his post just before battle and subsequently receives four white feathers from his friends and fiancee as symbols of what they believe to be his cowardice.,Shekhar Kapur ,"Heath Ledger, Wes Bentley, Kate Hudson, Mohamed Bouich",33447,$18.31M
152,153,Darfur,2009,98 min,"Drama, War            ",5.9,"ican journalists in Sudan are confronted with the dilemma of whether to return home to report on the atrocities they have seen, or to stay behind and help some of the victims they have encountered.",Uwe Boll ,"Kristanna Loken, David O'Hara, Noah Dalton Danby, Matt Frewer",2585,
153,154,Loin des hommes,2014,101 min,"Drama, War, Western            ",7.2,"ria, 1954. Two very different men thrown together by a world in turmoil are forced to flee across the Atlas mountains. Daru, the reclusive teacher, has to escort Mohamed, a villager accused of murder.",David Oelhoffen ,"Viggo Mortensen, Reda Kateb, Djemel Barek, Vincent Martin",7671,
154,155,V avguste 44-go,2001,109 min,"Action, Mystery, Drama            ",7.5,"movie is set in Belarus, where a team of counter-intelligence officers is given only three days to find a German radio operator posing as a Soviet soldier, behind soviet lines, on the ...                See full summary »
",Mikhail Ptashuk ,"Evgeniy Mironov, Vladislav Galkin, Yuri Kolokolnikov, Aleksey Petrenko",1532,
155,156,Doroga na Berlin,2015,82 min,"Drama, War            ",6.4,"film is based on a novella by the well-known Stoviet writer who served on the front, Emmanuil kazakevich ""Two in the Steppe"" and the war diaries of Konstantin Simonov.",Sergei Popov ,"Amir Abdykalov, Yuriy Borisov, Maksim Demchenko, Andrey Deryugin",603,
156,157,Kray,2010,124 min,"Adventure, Drama, History            ",6.5,"945, Soviet war hero Ignat is sent to work as a locomotive mechanic in a Siberian labor camp where he meets an assortment of Germans and Russians.",Aleksey Uchitel ,"Vladimir Mashkov, Anjorka Strechel, Yuliya Peresild, Sergey Garmash",3014,
157,158,Es war einmal in Deutschland...,2017,102 min,"Comedy, Drama, War            ",6.5,"d Berman and his friends, all Holocaust survivors, have only one purpose: to go to America as soon as possible. For this they need money. Close to his aim, David is not only deprived of his savings but also overtaken by his shady past.",Sam Garbarski ,"Moritz Bleibtreu, Antje Traue, Tim Seyfi, Mark Ivanir",1384,$0.07M
