,id,name,year,run_time,genre,rating,about,director,actors,votes,gross
162,163,It Must Be Heaven,2019,102 min,Comedy            ,7,maker Elia Suleiman travels to different cities and finds unexpected parallels to his homeland of Palestine.,Elia Suleiman ,"Elia Suleiman, Tarik Kopty, Kareem Ghneim, George Khleifi",4227,
163,164,The Artist,I) (,100 min,"Comedy, Drama, Romance            ",7.9,gomaniacal film star develops a relationship with a young dancer against the backdrop of Hollywood's silent era.,Michel Hazanavicius ,"Jean Dujardin, Bérénice Bejo, John Goodman, James Cromwell",235440,$44.67M
164,165,The Walk,II) ,123 min,"Action, Adventure, Biography            ",7.3,"974, high-wire artist Philippe Petit recruits a team of people to help him realize his dream: to walk the immense void between the World Trade Center towers.",Robert Zemeckis ,"Joseph Gordon-Levitt, Charlotte Le Bon, Guillaume Baillargeon, Émilie Leclerc",124052,$10.14M
165,166,The Sons of Katie Elder,1965,122 min,Western            ,7.2,h owner Katie Elder's four sons determine to avenge the murder of their father and the swindling of their mother.,Henry Hathaway ,"John Wayne, Dean Martin, Martha Hyer, Michael Anderson Jr.",16646,$13.33M
166,167,Om det oändliga,2019,78 min,"Drama, Fantasy            ",6.9," ABOUT ENDLESSNESS, Roy Andersson adds to his cinematic oeuvre with a reflection on human life in all its beauty and cruelty, its splendour and banality.",Roy Andersson ,"Jessica Louthander, Tatiana Delaunay, Anders Hellström, Bertil J. Nyberg",5094,
167,168,Photograph,I) (,110 min,"Drama, Romance            ",6.9,"ruggling street photographer in Mumbai, pressured to marry by his grandmother, convinces a shy stranger to pose as his fiancée. The pair develop a connection that transforms them in ways they could not expect.",Ritesh Batra ,"Nawazuddin Siddiqui, Sanya Malhotra, Sachin Khedekar, Denzil Smith",4714,$0.34M
168,169,The Pursuit of Happyness,2006,117 min,"Biography, Drama            ",8,ruggling salesman takes custody of his son as he's poised to begin a life-changing professional career.,Gabriele Muccino ,"Will Smith, Thandiwe Newton, Jaden Smith, Brian Howe",470598,$163.57M
169,170,45 Years,2015,91 min,"Drama, Romance            ",7.1,rried couple preparing to celebrate their wedding anniversary receives shattering news that promises to forever change the course of their lives.,Andrew Haigh ,"Charlotte Rampling, Tom Courtenay, Geraldine James, Dolly Wells",31981,$4.25M
170,171,Ayka,2018,100 min,Drama            ,7.1,or migrant woman in Moscow struggles with her life.,Sergei Dvortsevoy ,"Samal Yeslyamova, Zhipara Abdilaeva, Sergey Mazur, David Alaverdyan",1621,
171,172,Todos lo saben,2018,133 min,"Crime, Drama, Mystery            ",6.9,"a, a Spanish woman living in Buenos Aires, returns to her hometown outside Madrid with her two children to attend her sister's wedding. However, the trip is upset by unexpected events that bring secrets into the open.",Asghar Farhadi ,"Penélope Cruz, Javier Bardem, Ricardo Darín, Eduard Fernández",32054,$2.66M
172,173,Captain Fantastic,2016,118 min,"Comedy, Drama            ",7.9,"he forests of the Pacific Northwest, a father devoted to raising his six kids with a rigorous physical and intellectual education is forced to leave his paradise and enter the world, challenging his idea of what it means to be a parent.",Matt Ross ,"Viggo Mortensen, George MacKay, Samantha Isler, Annalise Basso",203628,$5.88M
173,174,Two Men in Town,2014,120 min,Drama            ,5.7,slim ex-con forms a friendship with his parole officer.,Rachid Bouchareb ,"Forest Whitaker, Harvey Keitel, Ellen Burstyn, Brenda Blethyn",2122,
174,175,Mar adentro,I) (,126 min,"Biography, Drama            ",8,"factual story of Spaniard Ramon Sampedro, who fought a 28 year campaign in favour of euthanasia and his own right to die.",Alejandro Amenábar ,"Javier Bardem, Belén Rueda, Lola Dueñas, Mabel Rivera",79548,$2.09M
175,176,Shane,1953,118 min,"Drama, Western            ",7.6,"ary gunfighter attempts to settle down with a homestead family, but a smoldering settler/rancher conflict forces him to act.",George Stevens ,"Alan Ladd, Jean Arthur, Van Heflin, Brandon De Wilde",38744,$20.00M
176,177,Kömür,2019,90 min,Drama            ,7.2,"ural northwest Iran, Gheirat, a modest charcoal producer, is pushed into a tragic spiral after his son, sentenced to jail, evades to Azerbaijan.",Esmaeel Monsef ,"Amin Hajiakbari Dizaji, Hadi Eftekharzade, Adhami Farid, Zhila Shahi",174,
177,178,La vérité,2019,106 min,Drama            ,6.5,"ormy reunion between scriptwriter Lumir with her famous mother and actress, Fabienne, against the backdrop of Fabienne's autobiographic book and her latest role in a Sci-Fi picture as a daughter of a mother who never grows old.",Hirokazu Koreeda ,"Catherine Deneuve, Juliette Binoche, Ethan Hawke, Clémentine Grenier",5815,
178,179,Rebel in the Rye,2017,106 min,"Biography, Drama, Romance            ",6.7,"life of celebrated but reclusive author, J.D. Salinger, who gained worldwide fame with the publication of his novel, ""The Catcher in the Rye"".",Danny Strong ,"Nicholas Hoult, Kevin Spacey, Victor Garber, Hope Davis",9071,$0.38M
179,180,Buta,2011,98 min,Drama            ,7.1,"a"" is the story of a lonely 7-year old boy (named Buta), who lives in a mountain village with his grandmother. He is befriended by an old man, a liquid soap merchant who once loved (and...                See full summary »
",Ilgar Najaf ,"Rafig Guliyev, Tofig Aliyev, Elnur Karimov, Laman Nabiyeva",92,
180,181,Hostiles,2017,134 min,"Drama, Western            ",7.2,"892, a legendary Army Captain reluctantly agrees to escort a Cheyenne chief and his family through dangerous territory.",Scott Cooper ,"Scott Shepherd, Rosamund Pike, Ava Cooper, Stella Cooper",77222,$29.82M
181,182,Wild,I) (,115 min,"Adventure, Biography, Drama            ",7.1,ronicle of one woman's one thousand one hundred mile solo hike undertaken as a way to recover from a recent personal tragedy.,Jean-Marc Vallée ,"Reese Witherspoon, Laura Dern, Gaby Hoffmann, Michiel Huisman",124403,$37.88M
182,183,Evge,2019,96 min,Drama            ,7.4,ther and a son from Crimean Tatar family transport the body of deceased older son and brother from Kyiv to bury him in Crimea.,Nariman Aliev ,"Akhtem Seitablaev, Remzi Bilyalov, Dariya Barihashvili, Viktor Zhdanov",1113,
183,184,Cold Mountain,2003,154 min,"Adventure, Drama, History            ",7.2,"he waning days of the American Civil War, a wounded soldier embarks on a perilous journey back home to Cold Mountain, North Carolina to reunite with his sweetheart.",Anthony Minghella ,"Jude Law, Nicole Kidman, Renée Zellweger, Eileen Atkins",142928,$95.64M
184,185,Vozvrashchenie,2003,110 min,Drama            ,8,"he Russian wilderness, two brothers face a range of new, conflicting emotions when their father - a man they know only through a single photograph - resurfaces.",Andrey Zvyagintsev ,"Vladimir Garin, Ivan Dobronravov, Konstantin Lavronenko, Nataliya Vdovina",44078,$0.50M
185,186,After the Wedding,2019,112 min,Drama            ,6.3,nager of an orphanage in Kolkata travels to New York to meet a benefactor.,Bart Freundlich ,"Julianne Moore, Michelle Williams, Billy Crudup, Abby Quinn",6896,$1.45M
186,187,Glubokie reki,2018,75 min,Drama            ,6.3," forgotten corner of the Caucasus, a family of lumberjacks chops wood in order to fulfill their contract with the sawmill. When the father is injured, the youngest brother, who left the impoverished region years before is called back.",Vladimir Bitokov ,"Oleg Gusejnov, Mariana Kazancheva, Roustam Muradov, Muhamed Sabiev",143,
187,188,Sorry We Missed You,2019,101 min,Drama            ,7.6,"ng that self-employment through gig economy can solve their financial woes, a hard-up UK delivery driver and his wife struggling to raise a family end up trapped in the vicious circle of this modern-day form of labour exploitation.",Ken Loach ,"Kris Hitchen, Debbie Honeywood, Rhys Stone, Katie Proctor",19315,
188,189,King Arthur,2004,126 min,"Action, Adventure, Drama            ",6.3,mystified take on the tale of King Arthur and the Knights of the Round Table.,Antoine Fuqua ,"Clive Owen, Stephen Dillane, Keira Knightley, Ioan Gruffudd",162723,$51.88M
189,190,Se rokh,2018,100 min,Drama            ,7,"e actresses at different stages of their career. One from before the 1979 Islamic Revolution, one popular star of today known throughout the country and a young girl longing to attend a drama conservatory.",Jafar Panahi ,"Behnaz Jafari, Jafar Panahi, Marziyeh Rezaei, Maedeh Erteghaei",3587,$0.07M
190,191,Midnight in Paris,2011,94 min,"Comedy, Fantasy, Romance            ",7.7,"e on a trip to Paris with his fiancée's family, a nostalgic screenwriter finds himself mysteriously going back to the 1920s every day at midnight.",Woody Allen ,"Owen Wilson, Rachel McAdams, Kathy Bates, Kurt Fuller",401437,$56.82M
191,192,Rusari Abi,1995,85 min,"Drama, Romance            ",6.8,"lderly owner of a tomato farm and sauce factory, after his wife's death, falls in love with one of the workers of the factory endangering his relationship with his daughters and in-laws...                See full summary »
",Rakhshan Banietemad ,"Ezzatolah Entezami, Fatemah Motamed-Aria, Golab Adineh, Afsar Asadi",626,
192,193,The Tin Star,1957,93 min,Western            ,7.3,"nical former sheriff turned bounty hunter helps a young, recently appointed acting sheriff with his advice, his experience and his gun.",Anthony Mann ,"Henry Fonda, Anthony Perkins, Betsy Palmer, Michel Ray",5518,
193,194,Marshall,2017,118 min,"Biography, Crime, Drama            ",7.3,"story of Thurgood Marshall, the crusading lawyer who would become the first African-American Supreme Court Justice, as he battles through one of his career-defining cases.",Reginald Hudlin ,"Chadwick Boseman, Josh Gad, Kate Hudson, Sterling K. Brown",22503,$10.05M
194,195,Darbareye Elly,2009,119 min,"Drama, Mystery            ",8,mysterious disappearance of a kindergarten teacher during a picnic in the north of Iran is followed by a series of misadventures for her fellow travelers.,Asghar Farhadi ,"Golshifteh Farahani, Shahab Hosseini, Taraneh Alidoosti, Merila Zare'i",49701,$0.11M
195,196,True Grit,2010,110 min,"Drama, Western            ",7.6,ubborn teenager enlists the help of a tough U.S. Marshal to track down her father's murderer.,"Ethan Coen, Joel Coen ","Jeff Bridges, Matt Damon, Hailee Steinfeld, Josh Brolin",321933,$171.24M
196,197,Limitless,I) (,105 min,"Sci-Fi, Thriller            ",7.4," the help of a mysterious pill that enables the user to access 100% of his brain's abilities, a struggling writer becomes a financial wizard, but it also puts him in a new world with many dangers.",Neil Burger ,"Bradley Cooper, Anna Friel, Abbie Cornish, Robert De Niro",542549,$79.25M
197,198,Kramer vs. Kramer,1979,105 min,Drama            ,7.8,"Kramer's wife leaves him, allowing for a lost bond to be rediscovered between Ted and his son, Billy. But a heated custody battle ensues over the divorced couple's son, deepening the wounds left by the separation.",Robert Benton ,"Dustin Hoffman, Meryl Streep, Jane Alexander, Justin Henry",138572,$106.26M
198,199,We Own the Night,2007,117 min,"Action, Crime, Drama            ",6.8,w York City nightclub manager tries to save his brother and father from Russian Mafia hitmen.,James Gray ,"Joaquin Phoenix, Mark Wahlberg, Eva Mendes, Danny Hoch",86826,$28.56M
199,200,Sokout,1998,76 min,"Drama, Music            ",7,"yday, 10-year old Khorsid takes the bus to his work at an instrument maker's shop and everyday something unexpected happens.",Mohsen Makhmalbaf ,"Tahmineh Normatova, Nadereh Abdelahyeva, Goibibi Ziadolahyeva, Araz M. Shirmohamadi",1610,$0.03M
