,id,name,year,run_time,genre,rating,about,director,actors,votes,gross
82,83,Não Pare na Pista: A Melhor História de Paulo Coelho,2014,112 min,"Biography, Drama, Music            ",5.6,ronicle of Paulo Coelho's rise from his troubled life to become one of the most influential writers in Brazilian history.,Daniel Augusto ,"Júlio Andrade, Ravel Andrade, Fabiana Gugli, Fabiula Nascimento",623,
83,84,Les quatre cents coups,1959,99 min,"Crime, Drama            ",8.1,"ung boy, left without attention, delves into a life of petty crime.",François Truffaut ,"Jean-Pierre Léaud, Albert Rémy, Claire Maurier, Guy Decomble",110834,
84,85,The Square,2017,151 min,"Comedy, Drama            ",7.2,estigious Stockholm museum's chief art curator finds himself in times of both professional and personal crisis as he attempts to set up a controversial new exhibit.,Ruben Östlund ,"Claes Bang, Elisabeth Moss, Dominic West, Terry Notary",59141,$1.50M
85,86,Slumdog Millionaire,2008,120 min,"Drama, Romance            ",8,"mbai teenager reflects on his life after being accused of cheating on the Indian version of ""Who Wants to be a Millionaire?"".","Danny Boyle, Loveleen Tandan ","Dev Patel, Freida Pinto, Saurabh Shukla, Anil Kapoor",816385,$141.32M
86,87,Arizona Raiders,1965,97 min,Western            ,6, Quantrill's (Quantrell) gang is almost destroyed two of the captured members agree to join the Arizona Rangers to help finish the job.,William Witney ,"Audie Murphy, Michael Dante, Ben Cooper, Buster Crabbe",1079,
87,88,Kona fer í stríð,2018,101 min,"Adventure, Comedy, Drama            ",7.4,"a becomes a determined environmental activist, but this threatens a long-held hope of hers.",Benedikt Erlingsson ,"Halldóra Geirharðsdóttir, Jóhann Sigurðarson, Juan Camilo Román Estrada, Jörundur Ragnarsson",8940,$0.85M
88,89,Groundhog Day,1993,101 min,"Comedy, Fantasy, Romance            ",8,atherman finds himself inexplicably living the same day over and over again.,Harold Ramis ,"Bill Murray, Andie MacDowell, Chris Elliott, Stephen Tobolowsky",594423,$70.91M
89,90,Estiu 1993,2017,97 min,"Adventure, Drama, Family            ",7.2,"r her mother's death, six-year-old Frida is sent to her uncle's family to live with them in the countryside. But Frida finds it hard to forget her mother and adapt to her new life.",Carla Simón ,"Laia Artigas, Paula Robles, Bruna Cusí, David Verdaguer",6867,$0.18M
90,91,Maudie,2016,115 min,"Biography, Drama, Romance            ",7.6,rthritic Nova Scotia woman works as a housekeeper while she hones her skills as an artist and eventually becomes a beloved figure in the community.,Aisling Walsh ,"Sally Hawkins, Ethan Hawke, Zachary Bennett, Gabrielle Rose",17215,$6.17M
91,92,The Man Who Knew Infinity,2015,108 min,"Biography, Drama            ",7.2,"story of the life and academic career of the pioneer Indian mathematician, Srinivasa Ramanujan, and his friendship with his mentor, Professor G.H. Hardy.",Matt Brown ,"Dev Patel, Jeremy Irons, Malcolm Sinclair, Raghuvir Joshi",53918,$3.87M
92,93,King Lear,2018,115 min,Drama            ,6.2,"ging King invites disaster when he abdicates to his corrupt, toadying daughters, and rejects his loving and honest one.",Richard Eyre ,"Jim Broadbent, Jim Carter, Tobias Menzies, Emily Watson",3428,
93,94,Awakenings,1990,121 min,"Biography, Drama            ",7.8,"victims of an encephalitis epidemic many years ago have been catatonic ever since, but now a new drug offers the prospect of reviving them.",Penny Marshall ,"Robert De Niro, Robin Williams, Julie Kavner, Ruth Nelson",132090,$52.10M
94,95,Manbiki kazoku,2018,121 min,"Crime, Drama            ",7.9,mily of small-time crooks take in a child they find outside in the cold.,Hirokazu Koreeda ,"Lily Franky, Sakura Andô, Kirin Kiki, Mayu Matsuoka",69107,$3.31M
95,96,Réparer les vivants,2016,103 min,Drama            ,6.9,"ngle devastating event intertwines inextricably the lives of an unfortunate teenager, a weary woman with a critical degenerative heart condition and a team of compassionate doctors; all perfect strangers, perfectly interconnected.",Katell Quillévéré ,"Tahar Rahim, Emmanuelle Seigner, Anne Dorval, Bouli Lanners",3128,$0.00M
96,97,Rooz-haye Narenji,2018,98 min,Drama            ,5.9," Aban - tough, self-sufficient, and the only woman contractor in the orange fields of northern Iran - beats out the male competition for a big job, the operation seems to get off to a rocky start. But Aban won't let go without a fight.",Arash Lahooti ,"Hediyeh Tehrani, Ali Mosaffa, Mehran Ahmadi, Alireza Ostadi",326,
97,98,Oiktos,2018,97 min,Drama            ,6.7,"story of a man who feels happy only when he is unhappy, a man addicted to sadness, who has such need for pity, he's willing to do everything to evoke it from others. This is the life of a man in a world not cruel enough for him.",Babis Makridis ,"Giannis Drakopoulos, Evi Saoulidou, Makis Papadimitriou, Nota Tserniafski",2895,
98,99,Forushande,2016,124 min,Drama            ,7.7,"e both participating in a production of ""Death of a Salesman,"" a teacher's wife is assaulted in her new home, which leaves him determined to find the perpetrator over his wife's traumatized objections.",Asghar Farhadi ,"Shahab Hosseini, Taraneh Alidoosti, Babak Karimi, Mina Sadati",55847,$2.40M
99,100,Ága,2018,96 min,Drama            ,7.3,"he far north, Sedna and Nanook dream of bringing back their family together. After Sedna's death, Nanook walks a long way to find his daughter Ága, who ran away years ago.",Milko Lazarov ,"Mikhail Aprosimov, Feodosia Ivanova, Sergei Egorov, Galina Tikhonova",1350,$0.00M
100,101,Wajib,2017,96 min,"Comedy, Drama            ",7.3,"ther and his estranged son must come together to hand deliver his daughter's wedding invitations to each guest as per local Palestinian custom, in this rousing family drama from Annemarie Jacir (When I Saw You).",Annemarie Jacir ,"Mohammad Bakri, Saleh Bakri, Tarik Kopty, Monera Shehadeh",1507,
101,102,Russkiy kovcheg,2002,99 min,"Drama, Fantasy, History            ",7.4,"th century French aristocrat, notorious for his scathing memoirs about life in Russia, travels through the Russian State Hermitage Museum and encounters historical figures from the last 200+ years.",Aleksandr Sokurov ,"Sergey Dreyden, Mariya Kuznetsova, Leonid Mozgovoy, Mikhail Piotrovsky",19825,$0.04M
102,103,Lazzaro felice,2018,128 min,"Drama, Fantasy, Mystery            ",7.5,nceasingly kind Italian peasant and his family are blatantly exploited by a tobacco baroness.,Alice Rohrwacher ,"Adriano Tardiolo, Agnese Graziani, Alba Rohrwacher, Luca Chikovani",16730,
103,104,Bin-jip,2004,88 min,"Crime, Drama, Romance            ",8,ansient young man breaks into empty homes to partake of the vacationing residents' lives for a few days.,Kim Ki-duk ,"Seung-Yun Lee, Hee Jae, Hyuk-ho Kwon, Jin-mo Joo",52758,$0.24M
104,105,Das weiße Band - Eine deutsche Kindergeschichte,2009,144 min,"Drama, History, Mystery            ",7.8,"nge events happen in a small village in the north of Germany during the years before World War I, which seem to be ritual punishment. Who is responsible?",Michael Haneke ,"Christian Friedel, Ernst Jacobi, Leonie Benesch, Ulrich Tukur",70863,$2.22M
105,106,Dead Man,1995,121 min,"Adventure, Drama, Fantasy            ",7.6,"he run after murdering a man, accountant William Blake encounters a strange aboriginal American man named Nobody who prepares him for his journey into the spiritual world.",Jim Jarmusch ,"Johnny Depp, Gary Farmer, Crispin Glover, Lance Henriksen",93276,$1.04M
106,107,An,2015,113 min,Drama            ,7.4,"ened with a heavy and ever-increasing debt, a dorayaki baker hires a kind ageing woman, after tasting her delicious surprise. Little by little, she unravels her beautiful inner world. Could she be holding the secret to his success?",Naomi Kawase ,"Kirin Kiki, Masatoshi Nagase, Kyara Uchida, Miki Mizuno",10476,$0.12M
107,108,L'ours,1988,96 min,"Adventure, Drama, Family            ",7.7,rphan bear cub hooks up with an adult male as they try to dodge human hunters.,Jean-Jacques Annaud ,"Tchéky Karyo, Bart the Bear, Youk the Bear, Jack Wallace",17269,$31.75M
108,109,The Professor and the Madman,2019,124 min,"Biography, Drama            ",7.3,"essor James Murray begins work compiling words for the first edition of the Oxford English Dictionary in the mid-19th century, and receives over 10,000 entries from a patient at Broadmoor Criminal Lunatic Asylum, Dr. William Minor.",Farhad Safinia ,"Mel Gibson, Sean Penn, Eddie Marsan, Natalie Dormer",40226,
109,110,Le scaphandre et le papillon,2007,112 min,"Biography, Drama            ",8,true story of Elle editor Jean-Dominique Bauby who suffers a stroke and has to live with an almost totally paralyzed body; only his left eye isn't paralyzed.,Julian Schnabel ,"Mathieu Amalric, Emmanuelle Seigner, Marie-Josée Croze, Anne Consigny",105451,$5.99M
110,111,A Late Quartet,2012,105 min,"Drama, Music            ",7.1,"ers of a world-renowned string quartet struggle to stay together in the face of death, competing egos and insuppressible lust.",Yaron Zilberman ,"Philip Seymour Hoffman, Christopher Walken, Catherine Keener, Mark Ivanir",14344,$1.56M
111,112,Reign Over Me,2007,124 min,Drama            ,7.4,n who lost his family in the September 11 attack on New York City runs into his old college roommate. Rekindling the friendship is the one thing that appears able to help the man recover from his grief.,Mike Binder ,"Adam Sandler, Don Cheadle, Jada Pinkett Smith, Liv Tyler",94330,$19.66M
112,113,Kurmanjan datka,2014,135 min,"Action, Biography, Drama            ",7.3,"relevant epic story of the strong-willed, courageous and independent woman before her time, Kurmanjan, who is revered to this day for her diplomacy for saving her nation from complete destruction when the Russians invaded.",Sadyk Sher-Niyaz ,"Elina Abai Kyzy, Nasira Mambetova, Aziz Muradillayev, Adilet Usubaliyev",3442,
113,114,Forget About Nick,2017,110 min,"Comedy, Drama, Romance            ",5.3,"nst the backdrop of New York's dazzling fashion scene, a woman in the process of transforming herself from a model into a designer is forced to live with her husband's ex-wife when he disappears without a trace.",Margarethe von Trotta ,"Ingrid Bolsø Berdal, Katja Riemann, Haluk Bilginer, Tinka Fürst",505,
114,115,Ghasr-e Shirin,2019,82 min,Drama            ,6.6," the mother of a separated family dies, Jalal the father returns to sort things out but he does not want to take the children with him.",Reza Mirkarimi ,"Hamed Behdad, Zhila Shahi, Azadeh Nobahari, Niousha Alipour",993,
115,116,Mudbound,2017,134 min,"Drama, War            ",7.4,"men return home from World War II to work on a farm in rural Mississippi, where they struggle to deal with racism and adjusting to life after war.",Dee Rees ,"Jason Mitchell, Carey Mulligan, Jason Clarke, Mary J. Blige",45758,
116,117,Metri Shesh Va Nim,2019,131 min,"Action, Crime, Drama            ",8,"police are after a drug lord named Naser Khakzad, but when they finally manage to catch him, he tries whatever he can think of to escape and save his family.",Saeed Roustayi ,"Payman Maadi, Navid Mohammadzadeh, Parinaz Izadyar, Farhad Aslani",10823,
117,118,Trilogia II: I skoni tou hronou,2008,125 min,Drama            ,6.6,"n American film director of Greek ancestry, is making a film that tells his story and the story of his parents. It is a tale that unfolds in Italy, Germany, Russia, Kazakhstan, Canada ...                See full summary »
",Theodoros Angelopoulos ,"Willem Dafoe, Bruno Ganz, Michel Piccoli, Irène Jacob",1818,
118,119,Mafak,2018,108 min,Drama            ,6.7,stinian director Bassam Jarbawi's debut feature film tackles the physical and emotional toll of one man's return home after 15 years in an Israeli jail.,Bassam Jarbawi ,"Ziad Bakri, Areen Omari, Jameel Khoury, Yasmine Qaddumi",246,
119,120,The Leisure Seeker,2017,112 min,"Adventure, Comedy, Drama            ",6.7,"naway couple go on an unforgettable journey in the faithful old RV they call ""The Leisure Seeker"".",Paolo Virzì ,"Helen Mirren, Donald Sutherland, Christian McKay, Janel Moloney",8111,$3.23M
120,121,Centaur,2017,89 min,Drama            ,6.6,aur lives a modest life with his family in rural Kyrgyzstan until he abruptly becomes the center of attention when he is caught stealing a racehorse at night. A story inspired by the myth when horses became the wings of men.,Aktan Arym Kubat ,"Nuraly Tursunkojoev, Zarema Asanalieva, Aktan Arym Kubat, Taalaikan Abazova",427,
121,122,Centaur,2017,89 min,Drama            ,6.6,aur lives a modest life with his family in rural Kyrgyzstan until he abruptly becomes the center of attention when he is caught stealing a racehorse at night. A story inspired by the myth when horses became the wings of men.,Aktan Arym Kubat ,"Nuraly Tursunkojoev, Zarema Asanalieva, Aktan Arym Kubat, Taalaikan Abazova",427,
122,123,Arrival,II) ,116 min,"Drama, Sci-Fi            ",7.9,nguist works with the military to communicate with alien lifeforms after twelve mysterious spacecraft appear around the world.,Denis Villeneuve ,"Amy Adams, Jeremy Renner, Forest Whitaker, Michael Stuhlbarg",629321,$100.55M
123,124,Mientras dure la guerra,2019,107 min,"Action, Adventure, Drama            ",6.9,er Miguel de Unamuno faces himself and his ideals after the 1936's military coup d'etat.,Alejandro Amenábar ,"Karra Elejalde, Eduard Fernández, Santi Prego, Nathalie Poza",6002,
124,125,Moneyball,2011,133 min,"Biography, Drama, Sport            ",7.6,and A's general manager Billy Beane's successful attempt to assemble a baseball team on a lean budget by employing computer-generated analysis to acquire new players.,Bennett Miller ,"Brad Pitt, Robin Wright, Jonah Hill, Philip Seymour Hoffman",389186,$75.61M
125,126,Code inconnu: Récit incomplet de divers voyages,2000,118 min,Drama            ,7.2,"ung man harasses a homeless woman, another man protests, the police arrest both and the woman has to leave the country. What were their various story-lines leading up to this event?",Michael Haneke ,"Juliette Binoche, Thierry Neuvic, Josef Bierbichler, Alexandre Hamidi",12954,$0.10M
126,127,Geumul,2016,114 min,Drama            ,7.4,"rth Korean fisherman breaks his boat engine by accident and drifts down to South Korea. After enduring brutal investigations in the South, he eventually gets sent back to North Korea.",Kim Ki-duk ,"Ryoo Seung-bum, Won-geun Lee, Kim Young-min, Gwi-hwa Choi",3469,
127,128,Five Easy Pieces,1970,98 min,Drama            ,7.5,"opout from upper-class America picks up work along the way on oil rigs when his life isn't spent in a squalid succession of bars, motels, and other points of interest.",Bob Rafelson ,"Jack Nicholson, Karen Black, Billy Green Bush, Fannie Flagg",35191,$5.51M
128,129,Zerkalo,1975,107 min,"Biography, Drama            ",8.1,"ing man in his forties remembers his past. His childhood, his mother, the war, personal moments and things that tell of the recent history of all the Russian nation.",Andrei Tarkovsky ,"Margarita Terekhova, Filipp Yankovskiy, Ignat Daniltsev, Oleg Yankovskiy",42974,$0.18M
129,130,Hrútar,2015,93 min,"Comedy, Drama            ",7.3," remote Icelandic farming valley, two brothers who haven't spoken in 40 years have to come together in order to save what's dearest to them - their sheep.",Grímur Hákonarson ,"Sigurður Sigurjónsson, Theodór Júlíusson, Charlotte Bøving, Jón Benónýsson",13609,$0.14M
130,131,Piremardha nemimirand,2019,85 min,"Comedy, Drama            ",7.4,"years old Aslan, the head of a death squad in his youth, is living with his other single old fellows in a remote village in the northern-west of Iran. Since he came to the village 45 ...                See full summary »
",Reza Jamali ,"Nader Mahdilou, Hamdollah Salimi, Salman Abbasi, Elena Azarm",294,
131,132,Serpico,1973,130 min,"Biography, Crime, Drama            ",7.7,onest New York cop named Frank Serpico blows the whistle on rampant corruption in the force only to have his comrades turn against him.,Sidney Lumet ,"Al Pacino, John Randolph, Jack Kehoe, Biff McGuire",116101,$29.80M
132,133,Loving Vincent,2017,94 min,"Animation, Biography, Crime            ",7.8," story depicted in oil painted animation, a young man comes to the last hometown of painter Vincent van Gogh (Robert Gulaczyk) to deliver the troubled artist's final letter and ends up investigating his final days there.","Dorota Kobiela, Hugh Welchman ","Douglas Booth, Jerome Flynn, Robert Gulaczyk, Helen McCrory",53844,$6.74M
133,134,Pomegranate Orchard,I) (,90 min,Drama            ,7.4,"l returns home to the humble family farmstead, surrounded by an orchard of venerable pomegranate trees; since his sudden departure twelve years ago he was never once in contact. However...                See full summary »
",Ilgar Najaf ,"Hasan Agayev, Samimi Farhad, Ilaha Hasanova, Gurban Ismailov",225,
134,135,Solaris,1972,167 min,"Drama, Mystery, Sci-Fi            ",8.1,ychologist is sent to a station orbiting a distant planet in order to discover what has caused the crew to go insane.,Andrei Tarkovsky ,"Natalya Bondarchuk, Donatas Banionis, Jüri Järvet, Vladislav Dvorzhetskiy",86326,
135,136,A United Kingdom,2016,111 min,"Biography, Drama, History            ",6.9,"story of King Seretse Khama of Botswana and how his loving but controversial marriage to a British white woman, Ruth Williams, put his kingdom into political and diplomatic turmoil.",Amma Asante ,"David Oyelowo, Rosamund Pike, Tom Felton, Jack Davenport",15520,$3.90M
136,137,Demolition,2015,101 min,"Comedy, Drama            ",7,"ccessful investment banker struggles after losing his wife in a tragic car crash. With the help of a customer service rep and her young son, he starts to rebuild, beginning with the demolition of the life he once knew.",Jean-Marc Vallée ,"Jake Gyllenhaal, Naomi Watts, Chris Cooper, Judah Lewis",93879,$1.98M
137,138,Indigènes,2006,123 min,"Action, Drama, War            ",7,"ng WWII, four North African men enlist in the French army to liberate that country from Nazi oppression, and to fight French discrimination.",Rachid Bouchareb ,"Samy Naceri, Roschdy Zem, Sami Bouajila, Jamel Debbouze",14346,$0.32M
138,139,Ta'm e guilass,1997,95 min,Drama            ,7.8,ranian man drives his truck in search of someone who will quietly bury him under a cherry tree after he commits suicide.,Abbas Kiarostami ,"Homayoun Ershadi, Abdolrahman Bagheri, Afshin Khorshid Bakhtiari, Safar Ali Moradi",26920,$0.31M
139,140,Selma,2014,128 min,"Biography, Drama, History            ",7.5,"ronicle of Dr. Martin Luther King, Jr.'s campaign to secure equal voting rights via an epic march from Selma to Montgomery, Alabama, in 1965.",Ava DuVernay ,"David Oyelowo, Carmen Ejogo, Oprah Winfrey, Tom Wilkinson",89048,$52.08M
140,141,Stalker,1979,162 min,"Drama, Sci-Fi            ",8.1,ide leads two men through an area known as the Zone to find a room that grants wishes.,Andrei Tarkovsky ,"Alisa Freyndlikh, Aleksandr Kaydanovskiy, Anatoliy Solonitsyn, Nikolay Grinko",125307,$0.23M
141,142,Shabi Ke Mah Kamel Shod,2019,131 min,"Adventure, Crime, Drama            ",6.8,"he market Abdolhamid meets Faezeh and falls in love with her. They get marry and begin their life. But after a while Faezeh becomes aware of Abdolhamid's family in Sistan and ...                See full summary »
",Narges Abyar ,"Elnaz Shakerdust, Hootan Shakiba, Fereshteh Sadre Orafaiy, Pedram Sharifi",2215,
142,143,Mahana,2016,103 min,Drama            ,7.1," the author of ""The Whale Rider"", a tale of family rivalry and reconciliation, set against the stunning backdrop of rural New Zealand in the 1960s.",Lee Tamahori ,"Temuera Morrison, Akuhata Keefe, Nancy Brunning, Jim Moriarty",882,
143,144,Croc-Blanc,2018,85 min,"Animation, Adventure            ",7,d on the timeless novel by Jack London. A loyal wolfdog's curiosity leads him on the adventure of a lifetime while serving a series of three distinctly different masters.,Alexandre Espigares ,"Raphaël Personnaz, Virginie Efira, Dominique Pinon, Frantz Confiac",3479,
144,145,Grbavica,2006,90 min,Drama            ,7.2,man and her daughter struggle to make their way through the aftermath of the Bosnian War.,Jasmila Zbanic ,"Mirjana Karanovic, Luna Zimic Mijovic, Leon Lucev, Kenan Catic",6439,$0.04M
145,146,Sorkhpust,2019,87 min,"Drama, History, Mystery            ",7.5,"ison is about to be evacuated to make room for an airport expansion project. Major Jahed and his officers are busy transferring all inmates to the new facility, but one inmate is missing.",Nima Javidi ,"Navid Mohammadzadeh, Parinaz Izadyar, Setareh Pesyani, Mani Haghighi",5096,
146,147,Gunfight at the O.K. Corral,1957,122 min,"Biography, Drama, Western            ",7.2,an Wyatt Earp and outlaw Doc Holliday form an unlikely alliance which culminates in their participation in the legendary Gunfight at the O.K. Corral.,John Sturges ,"Burt Lancaster, Kirk Douglas, Rhonda Fleming, Jo Van Fleet",14934,$11.75M
147,148,Turist,2014,120 min,"Comedy, Drama            ",7.3,mily vacationing in the French Alps is confronted with a devastating avalanche.,Ruben Östlund ,"Johannes Kuhnke, Lisa Loven Kongsli, Clara Wettergren, Vincent Wettergren",51648,$1.36M
148,149,Taxi Driver,1976,114 min,"Crime, Drama            ",8.2,"ntally unstable veteran works as a nighttime taxi driver in New York City, where the perceived decadence and sleaze fuels his urge for violent action by attempting to liberate a presidential campaign worker and an underage prostitute.",Martin Scorsese ,"Robert De Niro, Jodie Foster, Cybill Shepherd, Albert Brooks",758152,$28.26M
149,150,As I Lay Dying,2018,80 min,Drama            ,5.6,mily of four persons go to a remote village to bury their dead father there according to his will. But no one of them has heard anything about this village or visited it before.,Mostafa Sayari ,"Madjid Aghakarimi, Nader Fallah, Elham Korda, Vahid Rad",55,
150,151,"Roman J. Israel, Esq.",2017,122 min,"Crime, Drama, Thriller            ",6.5,"n J. Israel, Esq., a driven, idealistic defense attorney, finds himself in a tumultuous series of events that lead to a crisis and the necessity for extreme action.",Dan Gilroy ,"Denzel Washington, Colin Farrell, Carmen Ejogo, Lynda Gravatt",35723,$11.96M
151,152,Mia madre,2015,106 min,Drama            ,6.8,"herita, a director in the middle of an existential crisis, has to deal with the inevitable and still unacceptable loss of her mother.",Nanni Moretti ,"Margherita Buy, John Turturro, Giulia Lazzarini, Nanni Moretti",7207,$0.30M
152,153,Johnny Guitar,1954,110 min,"Drama, Western            ",7.6,"r helping a wounded gang member, a strong-willed female saloon owner is wrongly suspected of murder and bank robbery by a lynch mob.",Nicholas Ray ,"Joan Crawford, Sterling Hayden, Mercedes McCambridge, Scott Brady",16569,
153,154,Paterson,2016,118 min,"Comedy, Drama, Romance            ",7.4,"iet observation of the triumphs and defeats of daily life, along with the poetry evident in its smallest details.",Jim Jarmusch ,"Adam Driver, Golshifteh Farahani, Nellie, Rizwan Manji",75318,$2.14M
154,155,Wonder,I) (,113 min,"Drama, Family            ",8,"d on the New York Times bestseller, this movie tells the incredibly inspiring and heartwarming story of August Pullman, a boy with facial differences who enters the fifth grade, attending a mainstream elementary school for the first time.",Stephen Chbosky ,"Jacob Tremblay, Owen Wilson, Izabela Vidovic, Julia Roberts",152004,$132.42M
155,156,One Flew Over the Cuckoo's Nest,1975,133 min,Drama            ,8.7,"iminal pleads insanity and is admitted to a mental institution, where he rebels against the oppressive nurse and rallies up the scared patients.",Milos Forman ,"Jack Nicholson, Louise Fletcher, Michael Berryman, Peter Brocco",950593,$112.00M
156,157,The Bookshop,2017,113 min,Drama            ,6.5,"and 1959. In a small East Anglian town, Florence Green decides, against polite but ruthless local opposition, to open a bookshop.",Isabel Coixet ,"Emily Mortimer, Bill Nighy, Hunter Tremayne, Honor Kneafsey",14120,$1.33M
157,158,Once Upon a Time in the West,1968,165 min,Western            ,8.5,sterious stranger with a harmonica joins forces with a notorious desperado to protect a beautiful widow from a ruthless assassin working for the railroad.,Sergio Leone ,"Henry Fonda, Charles Bronson, Claudia Cardinale, Jason Robards",313239,$5.32M
158,159,Aloft,2014,112 min,Drama            ,5.3,ruggling mother encounters the son she abandoned 20 years earlier.,Claudia Llosa ,"Jennifer Connelly, Cillian Murphy, Mélanie Laurent, William Shimell",3546,$0.05M
159,160,Un village presque parfait,2014,98 min,Comedy            ,6,"nt-Far-la-Mauderne"", a small village hit hard by the crisis and desertification. His last hope: revive the salmon smoking factory. Only problem, insurance require the presence of a ...                See full summary »
",Stéphane Meunier ,"Didier Bourdon, Lorànt Deutsch, Lionnel Astier, Denis Podalydès",777,
160,161,Frida,2002,123 min,"Biography, Drama, Romance            ",7.4,"ography of artist Frida Kahlo, who channeled the pain of a crippling injury and her tempestuous marriage into her work.",Julie Taymor ,"Salma Hayek, Alfred Molina, Geoffrey Rush, Mía Maestro",84277,$25.89M
161,162,Frozen River,2008,97 min,"Crime, Drama            ",7.1,"m looks for another source of income, when her husband leaves with the money meant for the new mobile home. A nearby Indian territory stretches across the border to Canada with a drivable frozen river between. Smuggling?",Courtney Hunt ,"Melissa Leo, Misty Upham, Charlie McDermott, Michael O'Keefe",25283,$2.51M
