,id,name,year,run_time,genre,rating,about,director,actors,votes,gross
163,164,Hera Pheri,2000,156 min,"Action, Comedy, Crime            ",8.2,"e unemployed men look for answers to all their money problems - but when their opportunity arrives, will they know what to do with it?",Priyadarshan ,"Akshay Kumar, Sunil Shetty, Paresh Rawal, Tabu",61666,
164,165,Hacksaw Ridge,2016,139 min,"Biography, Drama, History            ",8.1,"d War II American Army Medic Desmond T. Doss, who served during the Battle of Okinawa, refuses to kill people and becomes the first man in American history to receive the Medal of Honor without firing a shot.",Mel Gibson ,"Andrew Garfield, Sam Worthington, Luke Bracey, Teresa Palmer",464312,$67.21M
165,166,Trainspotting,1996,93 min,Drama            ,8.1,"on, deeply immersed in the Edinburgh drug scene, tries to clean up and get out, despite the allure of the drugs and influence of friends.",Danny Boyle ,"Ewan McGregor, Ewen Bremner, Jonny Lee Miller, Kevin McKidd",654051,$16.50M
166,167,Blade Runner,1982,117 min,"Action, Sci-Fi, Thriller            ",8.1,"ade runner must pursue and terminate four replicants who stole a ship in space, and have returned to Earth to find their creator.",Ridley Scott ,"Harrison Ford, Rutger Hauer, Sean Young, Edward James Olmos",718664,$32.87M
167,168,Room,I) (,118 min,"Drama, Thriller            ",8.1," captive for 7 years in an enclosed space, a woman and her young son finally gain their freedom, allowing the boy to experience the outside world for the first time.",Lenny Abrahamson ,"Brie Larson, Jacob Tremblay, Sean Bridgers, Wendy Crewson",391065,$14.68M
168,169,Gone with the Wind,1939,238 min,"Drama, History, Romance            ",8.1,nipulative woman and a roguish man conduct a turbulent romance during the American Civil War and Reconstruction periods.,"Victor Fleming, George Cukor, Sam Wood ","Clark Gable, Vivien Leigh, Thomas Mitchell, Barbara O'Neil",300533,$198.68M
169,170,Heat,1995,170 min,"Crime, Drama, Thriller            ",8.2,oup of professional bank robbers start to feel the heat from police when they unknowingly leave a clue at their latest heist.,Michael Mann ,"Al Pacino, Robert De Niro, Val Kilmer, Jon Voight",603500,$67.44M
170,171,The Big Lebowski,1998,117 min,"Comedy, Crime, Sport            ",8.1," ""The Dude"" Lebowski, mistaken for a millionaire of the same name, seeks restitution for his ruined rug and enlists his bowling buddies to help get it.","Joel Coen, Ethan Coen ","Jeff Bridges, John Goodman, Julianne Moore, Steve Buscemi",762881,$17.50M
171,172,Warrior,2011,140 min,"Action, Drama, Sport            ",8.1,"youngest son of an alcoholic former boxer returns home, where he's trained by his father for competition in a mixed martial arts tournament - a path that puts the fighter on a collision course with his estranged, older brother.",Gavin O'Connor ,"Tom Hardy, Nick Nolte, Joel Edgerton, Jennifer Morrison",448443,$13.66M
172,173,Unforgiven,1992,130 min,"Drama, Western            ",8.2,"red Old West gunslinger William Munny reluctantly takes on one last job, with the help of his old partner Ned Logan and a young man, The ""Schofield Kid.""",Clint Eastwood ,"Clint Eastwood, Gene Hackman, Morgan Freeman, Richard Harris",390205,$101.16M
173,174,Pan's Labyrinth,2006,118 min,"Drama, Fantasy, War            ",8.2,"he Falangist Spain of 1944, the bookish young stepdaughter of a sadistic army officer escapes into an eerie but captivating fantasy world.",Guillermo del Toro ,"Ivana Baquero, Ariadna Gil, Sergi López, Maribel Verdú",636635,$37.63M
174,175,Inside Out,I) (,95 min,"Animation, Adventure, Comedy            ",8.1,"r young Riley is uprooted from her Midwest life and moved to San Francisco, her emotions - Joy, Fear, Anger, Disgust and Sadness - conflict on how best to navigate a new city, house, and school.","Pete Docter, Ronnie Del Carmen ","Amy Poehler, Bill Hader, Lewis Black, Mindy Kaling",650286,$356.46M
175,176,A Beautiful Mind,2001,135 min,"Biography, Drama            ",8.2,"r John Nash, a brilliant but asocial mathematician, accepts secret work in cryptography, his life takes a turn for the nightmarish.",Ron Howard ,"Russell Crowe, Ed Harris, Jennifer Connelly, Christopher Plummer",878322,$170.74M
176,177,The Deer Hunter,1978,183 min,"Drama, War            ",8.1,n-depth examination of the ways in which the U.S. Vietnam War impacts and disrupts the lives of people in a small industrial town in Pennsylvania.,Michael Cimino ,"Robert De Niro, Christopher Walken, John Cazale, John Savage",323463,$48.98M
177,178,The Thing,1982,109 min,"Horror, Mystery, Sci-Fi            ",8.1,search team in Antarctica is hunted by a shape-shifting alien that assumes the appearance of its victims.,John Carpenter ,"Kurt Russell, Wilford Brimley, Keith David, Richard Masur",388929,$13.78M
178,179,"Lock, Stock and Two Smoking Barrels",1998,107 min,"Action, Comedy, Crime            ",8.2," persuades his three pals to pool money for a vital poker game against a powerful local mobster, Hatchet Harry. Eddy loses, after which Harry gives him a week to pay back 500,000 pounds.",Guy Ritchie ,"Jason Flemyng, Dexter Fletcher, Nick Moran, Jason Statham",553353,$3.90M
179,180,Cool Hand Luke,1967,127 min,"Crime, Drama            ",8.1,"id back Southern man is sentenced to two years in a rural prison, but refuses to conform.",Stuart Rosenberg ,"Paul Newman, George Kennedy, Strother Martin, J.D. Cannon",169417,$16.22M
180,181,Raging Bull,1980,129 min,"Biography, Drama, Sport            ",8.2,"life of boxer Jake LaMotta, whose violence and temper that led him to the top in the ring destroyed his life outside of it.",Martin Scorsese ,"Robert De Niro, Cathy Moriarty, Joe Pesci, Frank Vincent",334469,$23.38M
181,182,Hauru no ugoku shiro,2004,119 min,"Animation, Adventure, Family            ",8.2," an unconfident young woman is cursed with an old body by a spiteful witch, her only chance of breaking the spell lies with a self-indulgent yet insecure young wizard and his companions in his legged, walking castle.",Hayao Miyazaki ,"Chieko Baishô, Takuya Kimura, Tatsuya Gashûin, Akihiro Miwa",355105,$4.71M
182,183,El secreto de sus ojos,2009,129 min,"Drama, Mystery, Romance            ",8.2,tired legal counselor writes a novel hoping to find closure for one of his past unresolved homicide cases and for his unreciprocated love with his superior - both of which still haunt him decades later.,Juan José Campanella ,"Ricardo Darín, Soledad Villamil, Pablo Rago, Carla Quevedo",200373,$6.39M
183,184,Incendies,2010,131 min,"Drama, Mystery, War            ",8.3,s journey to the Middle East to discover their family history and fulfill their mother's last wishes.,Denis Villeneuve ,"Lubna Azabal, Mélissa Désormeaux-Poulin, Maxim Gaudette, Mustafa Kamel",160595,$6.86M
184,185,Chinatown,1974,130 min,"Drama, Mystery, Thriller            ",8.2,"ivate detective hired to expose an adulterer finds himself caught up in a web of deceit, corruption, and murder.",Roman Polanski ,"Jack Nicholson, Faye Dunaway, John Huston, Perry Lopez",308250,$8.49M
185,186,The Great Escape,1963,172 min,"Adventure, Drama, History            ",8.2,ed prisoners of war plan for several hundred of their number to escape from a German camp during World War II.,John Sturges ,"Steve McQueen, James Garner, Richard Attenborough, Charles Bronson",232972,$12.10M
186,187,Tonari no Totoro,1988,86 min,"Animation, Family, Fantasy            ",8.2," two girls move to the country to be near their ailing mother, they have adventures with the wondrous forest spirits who live nearby.",Hayao Miyazaki ,"Hitoshi Takagi, Noriko Hidaka, Chika Sakamoto, Shigesato Itoi",308894,$1.11M
187,188,Det sjunde inseglet,1957,96 min,"Drama, Fantasy, History            ",8.2,"n seeks answers about life, death, and the existence of God as he plays chess against the Grim Reaper during the Black Plague.",Ingmar Bergman ,"Max von Sydow, Gunnar Björnstrand, Bengt Ekerot, Nils Poppe",174500,
188,189,On the Waterfront,1954,108 min,"Crime, Drama, Thriller            ",8.1,x-prize fighter turned longshoreman struggles to stand up to his corrupt union bosses.,Elia Kazan ,"Marlon Brando, Karl Malden, Lee J. Cobb, Rod Steiger",147859,$9.60M
189,190,The Bridge on the River Kwai,1957,161 min,"Adventure, Drama, War            ",8.1,"ish POWs are forced to build a railway bridge across the river Kwai for their Japanese captors, not knowing that the allied forces are planning to destroy it.",David Lean ,"William Holden, Alec Guinness, Jack Hawkins, Sessue Hayakawa",210522,$44.91M
190,191,Ran,1985,162 min,"Action, Drama, War            ",8.2,"edieval Japan, an elderly warlord retires, handing over his empire to his three sons. However, he vastly underestimates how the new-found power will corrupt them and cause them to turn on each other...and him.",Akira Kurosawa ,"Tatsuya Nakadai, Akira Terao, Jinpachi Nezu, Daisuke Ryû",118727,$4.14M
191,192,Rebecca,1940,130 min,"Drama, Mystery, Romance            ",8.1,lf-conscious woman juggles adjusting to her new role as an aristocrat's wife and avoiding being intimidated by his first wife's spectral presence.,Alfred Hitchcock ,"Laurence Olivier, Joan Fontaine, George Sanders, Judith Anderson",130512,$4.36M
192,193,Mary and Max.,2009,92 min,"Animation, Comedy, Drama            ",8.1,"le of friendship between two unlikely pen pals: Mary, a lonely, eight-year-old girl living in the suburbs of Melbourne, and Max, a forty-four-year old, severely obese man living in New York.",Adam Elliot ,"Toni Collette, Philip Seymour Hoffman, Eric Bana, Barry Humphries",169901,
193,194,Dial M for Murder,1954,105 min,"Crime, Thriller            ",8.2,rmer tennis player tries to arrange his wife's murder after learning of her affair.,Alfred Hitchcock ,"Ray Milland, Grace Kelly, Robert Cummings, John Williams",165872,$0.01M
194,195,Mr. Smith Goes to Washington,1939,129 min,"Comedy, Drama            ",8.1,"ive man is appointed to fill a vacancy in the United States Senate. His plans promptly collide with political corruption, but he doesn't back down.",Frank Capra ,"James Stewart, Jean Arthur, Claude Rains, Edward Arnold",110957,$9.60M
195,196,It Happened One Night,1934,105 min,"Comedy, Romance            ",8.1,"negade reporter and a crazy young heiress meet on a bus heading for New York, and end up stuck with each other when the bus leaves them behind at one of the stops.",Frank Capra ,"Clark Gable, Claudette Colbert, Walter Connolly, Roscoe Karns",98379,$4.36M
196,197,Smultronstället,1957,91 min,"Drama, Romance            ",8.2,"r living a life marked by coldness, an aging professor is forced to confront the emptiness of his existence.",Ingmar Bergman ,"Victor Sjöström, Bibi Andersson, Ingrid Thulin, Gunnar Björnstrand",101549,
197,198,Le salaire de la peur,1953,131 min,"Adventure, Drama, Thriller            ",8.1," decrepit South American village, four men are hired to transport an urgent nitroglycerine shipment without the equipment that would make it safe.",Henri-Georges Clouzot ,"Yves Montand, Charles Vanel, Peter van Eyck, Folco Lulli",57844,
198,199,The Gold Rush,1925,95 min,"Adventure, Comedy, Drama            ",8.2,ospector goes to the Klondike in search of gold and finds it and more.,Charles Chaplin ,"Charles Chaplin, Mack Swain, Tom Murray, Henry Bergman",105950,$5.45M
199,200,The General,1926,67 min,"Action, Adventure, Comedy            ",8.1," Union spies steal an engineer's beloved locomotive, he pursues it single-handedly and straight through enemy lines.","Clyde Bruckman, Buster Keaton ","Buster Keaton, Marion Mack, Glen Cavender, Jim Farley",86355,$1.03M
200,201,Le notti di Cabiria,1957,110 min,Drama            ,8.1,ifish prostitute wanders the streets of Rome looking for true love but finds only heartbreak.,Federico Fellini ,"Giulietta Masina, François Périer, Franca Marzi, Dorian Gray",45596,$0.75M
201,202,Guardians of the Galaxy Vol. 2,2017,136 min,"Action, Adventure, Comedy            ",7.6,"Guardians struggle to keep together as a team while dealing with their personal family issues, notably Star-Lord's encounter with his father the ambitious celestial being Ego.",James Gunn ,"Chris Pratt, Zoe Saldana, Dave Bautista, Vin Diesel",606432,$389.81M
202,203,Star Wars: Episode VII - The Force Awakens,2015,138 min,"Action, Adventure, Sci-Fi            ",7.8," new threat to the galaxy rises, Rey, a desert scavenger, and Finn, an ex-stormtrooper, must join Han Solo and Chewbacca to search for the one hope of restoring peace.",J.J. Abrams ,"Daisy Ridley, John Boyega, Oscar Isaac, Domhnall Gleeson",882891,$936.66M
203,204,Mad Max: Fury Road,2015,120 min,"Action, Adventure, Sci-Fi            ",8.1," post-apocalyptic wasteland, a woman rebels against a tyrannical ruler in search for her homeland with the aid of a group of female prisoners, a psychotic worshiper, and a drifter named Max.",George Miller ,"Tom Hardy, Charlize Theron, Nicholas Hoult, Zoë Kravitz",922558,$154.06M
204,205,No Country for Old Men,2007,122 min,"Crime, Drama, Thriller            ",8.1,ence and mayhem ensue after a hunter stumbles upon a drug deal gone wrong and more than two million dollars in cash near the Rio Grande.,"Ethan Coen, Joel Coen ","Tommy Lee Jones, Javier Bardem, Josh Brolin, Woody Harrelson",896350,$74.28M
205,206,Gone Girl,2014,149 min,"Drama, Mystery, Thriller            ",8.1," his wife's disappearance having become the focus of an intense media circus, a man sees the spotlight turned on him when it's suspected that he may not be innocent.",David Fincher ,"Ben Affleck, Rosamund Pike, Neil Patrick Harris, Tyler Perry",902490,$167.77M
206,207,Prisoners,2013,153 min,"Crime, Drama, Mystery            ",8.1," Keller Dover's daughter and her friend go missing, he takes matters into his own hands as the police pursue multiple leads and the pressure mounts.",Denis Villeneuve ,"Hugh Jackman, Jake Gyllenhaal, Viola Davis, Melissa Leo",633230,$61.00M
207,208,What Ever Happened to Baby Jane?,1962,134 min,"Drama, Horror, Thriller            ",8.1,rmer child star torments her paraplegic sister in their decaying Hollywood mansion.,Robert Aldrich ,"Bette Davis, Joan Crawford, Victor Buono, Wesley Addy",52570,$4.05M
208,209,Spotlight,I) (,129 min,"Biography, Crime, Drama            ",8.1,"true story of how the Boston Globe uncovered the massive scandal of child molestation and cover-up within the local Catholic Archdiocese, shaking the entire Catholic Church to its core.",Tom McCarthy ,"Mark Ruffalo, Michael Keaton, Rachel McAdams, Liev Schreiber",440287,$45.06M
209,210,The Princess Bride,1987,98 min,"Adventure, Family, Fantasy            ",8.1,"e home sick in bed, a young boy's grandfather reads him the story of a farmboy-turned-pirate who encounters numerous obstacles, enemies and allies in his quest to be reunited with his true love.",Rob Reiner ,"Cary Elwes, Mandy Patinkin, Robin Wright, Chris Sarandon",406646,$30.86M
210,211,Donnie Darko,2001,113 min,"Drama, Mystery, Sci-Fi            ",8,"r narrowly escaping a bizarre accident, a troubled teenager is plagued by visions of a man in a large rabbit suit who manipulates him to commit a series of crimes.",Richard Kelly ,"Jake Gyllenhaal, Jena Malone, Mary McDonnell, Holmes Osborne",761837,$1.48M
211,212,Stand by Me,1986,89 min,"Adventure, Drama            ",8.1,"r the death of one of his friends, a writer recounts a childhood journey with his friends to find the body of a missing boy.",Rob Reiner ,"Wil Wheaton, River Phoenix, Corey Feldman, Jerry O'Connell",378784,$52.29M
212,213,Into the Wild,2007,148 min,"Adventure, Biography, Drama            ",8.1,"r graduating from Emory University, top student and athlete Christopher McCandless abandons his possessions, gives his entire $24,000 savings account to charity and hitchhikes to Alaska to live in the wilderness. Along the way, Christopher encounters a series of characters that shape his life.",Sean Penn ,"Emile Hirsch, Vince Vaughn, Catherine Keener, Marcia Gay Harden",592242,$18.35M
213,214,The Sixth Sense,1999,107 min,"Drama, Mystery, Thriller            ",8.1,y who communicates with spirits seeks the help of a disheartened child psychologist.,M. Night Shyamalan ,"Bruce Willis, Haley Joel Osment, Toni Collette, Olivia Williams",939472,$293.51M
214,215,Shutter Island,2010,138 min,"Mystery, Thriller            ",8.2,"954, a U.S. Marshal investigates the disappearance of a murderer who escaped from a hospital for the criminally insane.",Martin Scorsese ,"Leonardo DiCaprio, Emily Mortimer, Mark Ruffalo, Ben Kingsley",1189340,$128.01M
215,216,The Grand Budapest Hotel,2014,99 min,"Adventure, Comedy, Crime            ",8.1,"iter encounters the owner of an aging high-class hotel, who tells him of his early years serving as a lobby boy in the hotel's glorious years under an exceptional concierge.",Wes Anderson ,"Ralph Fiennes, F. Murray Abraham, Mathieu Amalric, Adrien Brody",741741,$59.10M
216,217,The Help,2011,146 min,Drama            ,8,"spiring author during the civil rights movement of the 1960s decides to write a book detailing the African American maids' point of view on the white families for which they work, and the hardships they go through on a daily basis.",Tate Taylor ,"Emma Stone, Viola Davis, Octavia Spencer, Bryce Dallas Howard",438613,$169.71M
217,218,There Will Be Blood,2007,158 min,Drama            ,8.2,"ory of family, religion, hatred, oil and madness, focusing on a turn-of-the-century prospector in the early days of the business.",Paul Thomas Anderson ,"Daniel Day-Lewis, Paul Dano, Ciarán Hinds, Martin Stringer",542114,$40.22M
218,219,Catch Me If You Can,2002,141 min,"Biography, Crime, Drama            ",8.1,"ly 21 yet, Frank is a skilled forger who has passed as a doctor, lawyer and pilot. FBI agent Carl becomes obsessed with tracking down the con man, who only revels in the pursuit.",Steven Spielberg ,"Leonardo DiCaprio, Tom Hanks, Christopher Walken, Martin Sheen",879903,$164.62M
219,220,12 Years a Slave,2013,134 min,"Biography, Drama, History            ",8.1,"he antebellum United States, Solomon Northup, a free black man from upstate New York, is abducted and sold into slavery.",Steve McQueen ,"Chiwetel Ejiofor, Michael Kenneth Williams, Michael Fassbender, Brad Pitt",662629,$56.67M
220,221,The Wizard of Oz,1939,102 min,"Adventure, Family, Fantasy            ",8,thy Gale is swept away from her home in Kansas to the magical Land of Oz in a tornado and embarks on a quest with her new friends to see the Wizard who can help her return home and help her friends as well.,"Victor Fleming, George Cukor, Mervyn LeRoy, Norman Taurog, Richard Thorpe, King Vidor ","Judy Garland, Frank Morgan, Ray Bolger, Bert Lahr",378837,$2.08M
221,222,Rush,I) (,123 min,"Action, Biography, Drama            ",8.1,merciless 1970s rivalry between Formula One rivals James Hunt and Niki Lauda.,Ron Howard ,"Daniel Brühl, Chris Hemsworth, Olivia Wilde, Alexandra Maria Lara",450689,$26.95M
222,223,The Truman Show,1998,103 min,"Comedy, Drama            ",8.1,nsurance salesman discovers his whole life is actually a reality TV show.,Peter Weir ,"Jim Carrey, Ed Harris, Laura Linney, Noah Emmerich",984027,$125.62M
223,224,Platoon,1986,120 min,"Drama, War            ",8.1,"s Taylor, a neophyte recruit in Vietnam, finds himself caught in a battle of wills between two sergeants, one good and the other evil. A shrewd examination of the brutality of war and the duality of man in conflict.",Oliver Stone ,"Charlie Sheen, Tom Berenger, Willem Dafoe, Keith David",394071,$138.53M
224,225,Million Dollar Baby,2004,132 min,"Drama, Sport            ",8.1,termined woman works with a hardened boxing trainer to become a professional.,Clint Eastwood ,"Hilary Swank, Clint Eastwood, Morgan Freeman, Jay Baruchel",655549,$100.49M
225,226,The Bourne Ultimatum,2007,115 min,"Action, Adventure, Mystery            ",8,n Bourne dodges a ruthless C.I.A. official and his Agents from a new assassination program while searching for the origins of his life as a trained killer.,Paul Greengrass ,"Matt Damon, Edgar Ramírez, Joan Allen, Julia Stiles",615466,$227.47M
226,227,Stalker,1979,162 min,"Drama, Sci-Fi            ",8.1,ide leads two men through an area known as the Zone to find a room that grants wishes.,Andrei Tarkovsky ,"Alisa Freyndlikh, Aleksandr Kaydanovskiy, Anatoliy Solonitsyn, Nikolay Grinko",125307,$0.23M
227,228,Relatos salvajes,2014,122 min,"Comedy, Drama, Thriller            ",8.1,short stories that explore the extremities of human behavior involving people in distress.,Damián Szifron ,"Darío Grandinetti, María Marull, Mónica Villa, Diego Starosta",185982,$3.11M
228,229,Hachi: A Dog's Tale,2009,93 min,"Biography, Drama, Family            ",8.1,llege professor bonds with an abandoned dog he takes into his home.,Lasse Hallström ,"Richard Gere, Joan Allen, Cary-Hiroyuki Tagawa, Sarah Roemer",265377,
229,230,How to Train Your Dragon,2010,98 min,"Animation, Action, Adventure            ",8.1,"pless young Viking who aspires to hunt dragons becomes the unlikely friend of a young dragon himself, and learns there may be more to the creatures than he assumed.","Dean DeBlois, Chris Sanders ","Jay Baruchel, Gerard Butler, Christopher Mintz-Plasse, Craig Ferguson",691209,$217.58M
230,231,Annie Hall,1977,93 min,"Comedy, Romance            ",8," Singer, a divorced Jewish comedian, reflects on his relationship with ex-lover Annie Hall, an aspiring nightclub singer, which ended abruptly just like his previous marriages.",Woody Allen ,"Woody Allen, Diane Keaton, Tony Roberts, Carol Kane",257519,$39.20M
231,232,Ben-Hur,1959,212 min,"Adventure, Drama, History            ",8.1,"r a Jewish prince is betrayed and sent into slavery by a Roman friend, he regains his freedom and comes back for revenge.",William Wyler ,"Charlton Heston, Jack Hawkins, Stephen Boyd, Haya Harareet",227839,$74.70M
232,233,Before Sunrise,1995,101 min,"Drama, Romance            ",8.1,"ung man and woman meet on a train in Europe, and wind up spending one evening together in Vienna. Unfortunately, both know that this will probably be their only night together.",Richard Linklater ,"Ethan Hawke, Julie Delpy, Andrea Eckert, Hanno Pöschl",285432,$5.54M
233,234,Fa yeung nin wah,2000,98 min,"Drama, Romance            ",8.1,"neighbors form a strong bond after both suspect extramarital activities of their spouses. However, they agree to keep their bond platonic so as not to commit similar wrongs.",Kar-Wai Wong ,"Tony Chiu-Wai Leung, Maggie Cheung, Siu Ping-Lam, Tung Cho 'Joe' Cheung",135241,$2.73M
234,235,Hotel Rwanda,2004,121 min,"Biography, Drama, History            ",8.1," Rusesabagina, a hotel manager, houses over a thousand Tutsi refugees during their struggle against the Hutu militia in Rwanda, Africa.",Terry George ,"Don Cheadle, Sophie Okonedo, Joaquin Phoenix, Xolani Mali",342674,$23.53M
235,236,Butch Cassidy and the Sundance Kid,1969,110 min,"Biography, Crime, Drama            ",8,"ing, early 1900s. Butch Cassidy and The Sundance Kid are the leaders of a band of outlaws. After a train robbery goes wrong they find themselves on the run with a posse hard on their heels. Their solution - escape to Bolivia.",George Roy Hill ,"Paul Newman, Robert Redford, Katharine Ross, Strother Martin",208370,$102.31M
236,237,Gandhi,1982,191 min,"Biography, Drama, History            ",8,life of the lawyer who became the famed leader of the Indian revolts against the British rule through his philosophy of nonviolent protest.,Richard Attenborough ,"Ben Kingsley, John Gielgud, Rohini Hattangadi, Roshan Seth",223264,$52.77M
237,238,Barry Lyndon,1975,185 min,"Adventure, Drama, History            ",8.1,rish rogue wins the heart of a rich widow and assumes her dead husband's aristocratic position in 18th-century England.,Stanley Kubrick ,"Ryan O'Neal, Marisa Berenson, Patrick Magee, Hardy Krüger",157429,
238,239,Salinui chueok,2003,131 min,"Crime, Drama, Mystery            ",8.1," small Korean province in 1986, two detectives struggle with the case of multiple young women being found raped and murdered by an unknown culprit.",Bong Joon Ho ,"Kang-ho Song, Kim Sang-kyung, Roe-ha Kim, Jae-ho Song",156502,$0.01M
239,240,Life of Brian,1979,94 min,Comedy            ,8.1," on the original Christmas in the stable next door to Jesus Christ, Brian of Nazareth spends his life being mistaken for a messiah.",Terry Jones ,"Graham Chapman, John Cleese, Michael Palin, Terry Gilliam",380278,$20.05M
240,241,Mou gaan dou,2002,101 min,"Action, Crime, Drama            ",8,"ory between a mole in the police department and an undercover cop. Their objectives are the same: to find out who is the mole, and who is the cop.","Andrew Lau, Alan Mak ","Andy Lau, Tony Chiu-Wai Leung, Anthony Chau-Sang Wong, Eric Tsang",120881,$0.17M
241,242,La haine,1995,98 min,"Crime, Drama            ",8.1,ours in the lives of three young men in the French suburbs the day after a violent riot.,Mathieu Kassovitz ,"Vincent Cassel, Hubert Koundé, Saïd Taghmaoui, Abdel Ahmed Ghili",159132,$0.31M
242,243,In the Name of the Father,1993,133 min,"Biography, Crime, Drama            ",8.1,n's coerced confession to an I.R.A. bombing he did not commit results in the imprisonment of his father as well. An English lawyer fights to free them.,Jim Sheridan ,"Daniel Day-Lewis, Pete Postlethwaite, Alison Crosbie, Philip King",165100,$25.01M
243,244,Amores perros,2000,154 min,"Drama, Thriller            ",8.1,"rrific car accident connects three stories, each involving characters dealing with loss, regret, and life's harsh realities, all in the name of love.",Alejandro G. Iñárritu ,"Emilio Echevarría, Gael García Bernal, Goya Toledo, Álvaro Guerrero",231447,$5.38M
