,id,name,year,run_time,genre,rating,about,director,actors,votes,gross
244,245,Network,1976,121 min,Drama            ,8.1,levision network cynically exploits a deranged former anchor's ravings and revelations about the news media for its own profit.,Sidney Lumet ,"Faye Dunaway, William Holden, Peter Finch, Robert Duvall",151739,
245,246,Kaze no tani no Naushika,1984,117 min,"Animation, Adventure, Fantasy            ",8.1,ior and pacifist Princess Nausicaä desperately struggles to prevent two warring nations from destroying themselves and their dying planet.,Hayao Miyazaki ,"Sumi Shimamoto, Mahito Tsujimura, Hisako Kyôda, Gorô Naya",159065,$0.50M
246,247,The Maltese Falcon,1941,100 min,"Crime, Film-Noir, Mystery            ",8,"ivate detective takes on a case that involves him with three eccentric criminals, a gorgeous liar, and their quest for a priceless statuette.",John Huston ,"Humphrey Bogart, Mary Astor, Gladys George, Peter Lorre",152956,$2.11M
247,248,Persona,1966,85 min,"Drama, Thriller            ",8.1,rse is put in charge of a mute actress and finds that their personae are melding together.,Ingmar Bergman ,"Bibi Andersson, Liv Ullmann, Margaretha Krook, Gunnar Björnstrand",109897,
248,249,The Grapes of Wrath,1940,129 min,"Drama, History            ",8.1,"or Midwest family is forced off their land. They travel to California, suffering the misfortunes of the homeless in the Great Depression.",John Ford ,"Henry Fonda, Jane Darwell, John Carradine, Charley Grapewin",89294,$0.06M
249,250,Jaws,1975,124 min,"Adventure, Thriller            ",8," a killer shark unleashes chaos on a beach community, it's up to a local sheriff, a marine biologist, and an old seafarer to hunt the beast down.",Steven Spielberg ,"Roy Scheider, Robert Shaw, Richard Dreyfuss, Lorraine Gary",562893,$260.00M
