,id,name,year,run_time,genre,rating,about,director,actors,votes,gross
80,81,Nuovo Cinema Paradiso,1988,155 min,"Drama, Romance            ",8.5,lmmaker recalls his childhood when falling in love with the pictures at the cinema of his home village and forms a deep friendship with the cinema's projectionist.,Giuseppe Tornatore ,"Philippe Noiret, Enzo Cannavale, Antonella Attili, Isa Danieli",243943,$11.99M
81,82,The Great Dictator,1940,125 min,"Comedy, Drama, War            ",8.4,ator Adenoid Hynkel tries to expand his empire while a poor Jewish barber tries to avoid persecution from Hynkel's regime.,Charles Chaplin ,"Charles Chaplin, Paulette Goddard, Jack Oakie, Reginald Gardiner",212397,$0.29M
82,83,Modern Times,1936,87 min,"Comedy, Drama, Family            ",8.5,Tramp struggles to live in modern industrial society with the help of a young homeless woman.,Charles Chaplin ,"Charles Chaplin, Paulette Goddard, Henry Bergman, Tiny Sandford",227604,$0.16M
83,84,Paths of Glory,1957,88 min,"Drama, War            ",8.4,"r refusing to attack an enemy position, a general accuses the soldiers of cowardice and their commanding officer must defend them.",Stanley Kubrick ,"Kirk Douglas, Ralph Meeker, Adolphe Menjou, George Macready",186321,
84,85,Taare Zameen Par,2007,165 min,"Drama, Family            ",8.4,"ight-year-old boy is thought to be a lazy trouble-maker, until the new art teacher has the patience and compassion to discover the real problem behind his struggles in school.","Aamir Khan, Amole Gupte ","Darsheel Safary, Aamir Khan, Tisca Chopra, Vipin Sharma",179742,$1.22M
85,86,Aliens,1986,137 min,"Action, Adventure, Sci-Fi            ",8.3,"y-seven years after surviving an apocalyptic attack aboard her space vessel by merciless space creatures, Officer Ripley awakens from hyper-sleep and tries to warn anyone who will listen about the predators.",James Cameron ,"Sigourney Weaver, Michael Biehn, Carrie Henn, Paul Reiser",676091,$85.16M
86,87,Django Unchained,2012,165 min,"Drama, Western            ",8.4," the help of a German bounty-hunter, a freed slave sets out to rescue his wife from a brutal plantation-owner in Mississippi.",Quentin Tarantino ,"Jamie Foxx, Christoph Waltz, Leonardo DiCaprio, Kerry Washington",1419592,$162.81M
87,88,American Beauty,1999,122 min,Drama            ,8.3,xually frustrated suburban father has a mid-life crisis after becoming infatuated with his daughter's best friend.,Sam Mendes ,"Kevin Spacey, Annette Bening, Thora Birch, Wes Bentley",1101274,$130.10M
88,89,The Shining,1980,146 min,"Drama, Horror            ",8.4,"mily heads to an isolated hotel for the winter where a sinister presence influences the father into violence, while his psychic son sees horrific forebodings from both past and future.",Stanley Kubrick ,"Jack Nicholson, Shelley Duvall, Danny Lloyd, Scatman Crothers",937789,$44.02M
89,90,Requiem for a Dream,2000,102 min,Drama            ,8.3,drug-induced utopias of four Coney Island people are shattered when their addictions run deep.,Darren Aronofsky ,"Ellen Burstyn, Jared Leto, Jennifer Connelly, Marlon Wayans",792900,$3.64M
90,91,Braveheart,1995,178 min,"Biography, Drama, History            ",8.3,tish warrior William Wallace leads his countrymen in a rebellion to free his homeland from the tyranny of King Edward I of England.,Mel Gibson ,"Mel Gibson, Sophie Marceau, Patrick McGoohan, Angus Macfadyen",985832,$75.60M
91,92,Oldeuboi,2003,120 min,"Action, Drama, Mystery            ",8.4,"r being kidnapped and imprisoned for fifteen years, Oh Dae-Su is released, only to find that he must find his captor in five days.",Park Chan-Wook ,"Choi Min-sik, Yoo Ji-Tae, Kang Hye-jeong, Kim Byeong-Ok",538244,$0.71M
92,93,Star Wars: Episode VI - Return of the Jedi,1983,131 min,"Action, Adventure, Fantasy            ",8.3,"r a daring mission to rescue Han Solo from Jabba the Hutt, the Rebels dispatch to Endor to destroy the second Death Star. Meanwhile, Luke struggles to help Darth Vader back from the dark side without falling into the Emperor's trap.",Richard Marquand ,"Mark Hamill, Harrison Ford, Carrie Fisher, Billy Dee Williams",982964,$309.13M
93,94,North by Northwest,1959,136 min,"Adventure, Mystery, Thriller            ",8.3,w York City advertising executive goes on the run after being mistaken for a government agent by a group of foreign spies.,Alfred Hitchcock ,"Cary Grant, Eva Marie Saint, James Mason, Jessie Royce Landis",311021,$13.28M
94,95,Le fabuleux destin d'Amélie Poulain,2001,122 min,"Comedy, Romance            ",8.3,"ie is an innocent and naive girl in Paris with her own sense of justice. She decides to help those around her and, along the way, discovers love.",Jean-Pierre Jeunet ,"Audrey Tautou, Mathieu Kassovitz, Rufus, Lorella Cravotta",722827,$33.23M
95,96,Once Upon a Time in America,1984,229 min,"Crime, Drama            ",8.4,"rmer Prohibition-era Jewish gangster returns to the Lower East Side of Manhattan over thirty years later, where he once again must confront the ghosts and regrets of his old life.",Sergio Leone ,"Robert De Niro, James Woods, Elizabeth McGovern, Treat Williams",326213,$5.32M
96,97,3 Idiots,2009,170 min,"Comedy, Drama            ",8.4,"friends are searching for their long lost companion. They revisit their college days and recall the memories of their friend who inspired them to think differently, even as the rest of the world called them ""idiots"".",Rajkumar Hirani ,"Aamir Khan, Madhavan, Mona Singh, Sharman Joshi",365791,$6.53M
97,98,Mononoke-hime,1997,134 min,"Animation, Action, Adventure            ",8.4," journey to find the cure for a Tatarigami's curse, Ashitaka finds himself in the middle of a war between the forest gods and Tatara, a mining colony. In this quest he also meets San, the Mononoke Hime.",Hayao Miyazaki ,"Yôji Matsuda, Yuriko Ishida, Yûko Tanaka, Billy Crudup",362806,$2.38M
98,99,Vertigo,1958,128 min,"Mystery, Romance, Thriller            ",8.3,rmer police detective juggles wrestling with his personal demons and becoming obsessed with a hauntingly beautiful woman.,Alfred Hitchcock ,"James Stewart, Kim Novak, Barbara Bel Geddes, Tom Helmore",380424,$3.20M
99,100,Citizen Kane,1941,119 min,"Drama, Mystery            ",8.3,"owing the death of publishing tycoon Charles Foster Kane, reporters scramble to uncover the meaning of his final utterance; 'Rosebud'.",Orson Welles ,"Orson Welles, Joseph Cotten, Dorothy Comingore, Agnes Moorehead",420868,$1.59M
100,101,Das Boot,1981,149 min,"Adventure, Drama, Thriller            ",8.3,"claustrophobic world of a WWII German U-boat; boredom, filth and sheer terror.",Wolfgang Petersen ,"Jürgen Prochnow, Herbert Grönemeyer, Klaus Wennemann, Hubertus Bengsch",239727,$11.49M
101,102,M - Eine Stadt sucht einen Mörder,1931,117 min,"Crime, Mystery, Thriller            ",8.3," the police in a German city are unable to catch a child-murderer, other criminals join in the manhunt.",Fritz Lang ,"Peter Lorre, Ellen Widmann, Inge Landgut, Otto Wernicke",149870,$0.03M
102,103,Jodaeiye Nader az Simin,2011,123 min,Drama            ,8.3,rried couple are faced with a difficult decision - to improve the life of their child by moving to another country or to stay in Iran and look after a deteriorating parent who has Alzheimer's disease.,Asghar Farhadi ,"Payman Maadi, Leila Hatami, Sareh Bayat, Shahab Hosseini",230944,$7.10M
103,104,Bacheha-Ye aseman,1997,89 min,"Drama, Family, Sport            ",8.3,"r a boy loses his sister's pair of shoes, he goes on a series of adventures in order to find them. When he can't, he tries a new way to ""win"" a new pair.",Majid Majidi ,"Mohammad Amir Naji, Amir Farrokh Hashemian, Bahare Seddiqi, Nafise Jafar-Mohammadi",69764,$0.93M
104,105,Witness for the Prosecution,1957,116 min,"Crime, Drama, Mystery            ",8.4,teran British barrister must defend his client in a murder trial that has surprise after surprise.,Billy Wilder ,"Tyrone Power, Marlene Dietrich, Charles Laughton, Elsa Lanchester",115438,$8.18M
105,106,Drishyam,2015,163 min,"Crime, Drama, Mystery            ",8.2,"erate measures are taken by a man who tries to save his family from the dark side of the law, after they commit an unexpected crime.",Nishikant Kamat ,"Ajay Devgn, Shriya Saran, Tabu, Rajat Kapoor",76375,$0.74M
106,107,Eskiya,1996,128 min,"Crime, Drama, Thriller            ",8.2,"n the Bandit, released from prison after 35 years, searches for vengeance and his lover.",Yavuz Turgul ,"Sener Sen, Ugur Yücel, Sermin Hürmeriç, Yesim Salkim",67347,
107,108,La La Land,2016,128 min,"Comedy, Drama, Music            ",8,"e navigating their careers in Los Angeles, a pianist and an actress fall in love while attempting to reconcile their aspirations for the future.",Damien Chazelle ,"Ryan Gosling, Emma Stone, Rosemarie DeWitt, J.K. Simmons",534178,$151.10M
108,109,Inglourious Basterds,2009,153 min,"Adventure, Drama, War            ",8.3,"azi-occupied France during World War II, a plan to assassinate Nazi leaders by a group of Jewish U.S. soldiers coincides with a theatre owner's vengeful plans for the same.",Quentin Tarantino ,"Brad Pitt, Diane Kruger, Eli Roth, Mélanie Laurent",1326343,$120.54M
109,110,Good Will Hunting,1997,126 min,"Drama, Romance            ",8.3," Hunting, a janitor at M.I.T., has a gift for mathematics, but needs help from a psychologist to find direction in his life.",Gus Van Sant ,"Robin Williams, Matt Damon, Ben Affleck, Stellan Skarsgård",896670,$138.43M
110,111,Snatch,2000,104 min,"Comedy, Crime            ",8.3,"rupulous boxing promoters, violent bookmakers, a Russian gangster, incompetent amateur robbers and supposedly Jewish jewelers fight to track down a priceless stolen diamond.",Guy Ritchie ,"Jason Statham, Brad Pitt, Stephen Graham, Vinnie Jones",808687,$30.33M
111,112,Batman Begins,2005,140 min,"Action, Adventure            ",8.2,"r training with his mentor, Batman begins his fight to free crime-ridden Gotham City from corruption.",Christopher Nolan ,"Christian Bale, Michael Caine, Ken Watanabe, Liam Neeson",1355080,$206.85M
112,113,Taxi Driver,1976,114 min,"Crime, Drama            ",8.2,"ntally unstable veteran works as a nighttime taxi driver in New York City, where the perceived decadence and sleaze fuels his urge for violent action by attempting to liberate a presidential campaign worker and an underage prostitute.",Martin Scorsese ,"Robert De Niro, Jodie Foster, Cybill Shepherd, Albert Brooks",758152,$28.26M
113,114,Eternal Sunshine of the Spotless Mind,2004,108 min,"Drama, Romance, Sci-Fi            ",8.3," their relationship turns sour, a couple undergoes a medical procedure to have each other erased from their memories.",Michel Gondry ,"Jim Carrey, Kate Winslet, Tom Wilkinson, Gerry Robert Byrne",944743,$34.40M
114,115,A Clockwork Orange,1971,136 min,"Crime, Drama, Sci-Fi            ",8.3,"he future, a sadistic gang leader is imprisoned and volunteers for a conduct-aversion experiment, but it doesn't go as planned.",Stanley Kubrick ,"Malcolm McDowell, Patrick Magee, Michael Bates, Warren Clarke",783165,$6.21M
115,116,Reservoir Dogs,1992,99 min,"Crime, Drama, Thriller            ",8.3," a simple jewelry heist goes horribly wrong, the surviving criminals begin to suspect that one of them is a police informant.",Quentin Tarantino ,"Harvey Keitel, Tim Roth, Michael Madsen, Chris Penn",954209,$2.83M
116,117,Full Metal Jacket,1987,116 min,"Drama, War            ",8.3,agmatic U.S. Marine observes the dehumanizing effects the Vietnam War has on his fellow recruits from their brutal boot camp training to the bloody street fighting in Hue.,Stanley Kubrick ,"Matthew Modine, R. Lee Ermey, Vincent D'Onofrio, Adam Baldwin",699003,$46.36M
117,118,2001: A Space Odyssey,1968,149 min,"Adventure, Sci-Fi            ",8.3,"r discovering a mysterious artifact buried beneath the Lunar surface, mankind sets off on a quest to find its origins with help from intelligent supercomputer H.A.L. 9000.",Stanley Kubrick ,"Keir Dullea, Gary Lockwood, William Sylvester, Daniel Richter",627172,$56.95M
118,119,Der Untergang,2004,156 min,"Biography, Drama, History            ",8.2,"dl Junge, the final secretary for Adolf Hitler, tells of the Nazi dictator's final days in his Berlin bunker at the end of WWII.",Oliver Hirschbiegel ,"Bruno Ganz, Alexandra Maria Lara, Ulrich Matthes, Juliane Köhler",340893,$5.51M
119,120,Jagten,2012,115 min,Drama            ,8.3,"acher lives a lonely life, all the while struggling over his son's custody. His life slowly gets better as he finds love and receives good news from his son, but his new luck is about to be brutally shattered by an innocent little lie.",Thomas Vinterberg ,"Mads Mikkelsen, Thomas Bo Larsen, Annika Wedderkopp, Lasse Fogelstrøm",301209,$0.69M
120,121,L.A. Confidential,1997,138 min,"Crime, Drama, Mystery            ",8.2,"orruption grows in 1950s Los Angeles, three policemen - one strait-laced, one brutal, and one sleazy - investigate a series of murders with their own brand of justice.",Curtis Hanson ,"Kevin Spacey, Russell Crowe, Guy Pearce, Kim Basinger",550069,$64.62M
121,122,American Psycho,2000,101 min,"Comedy, Crime, Drama            ",7.6,"althy New York City investment banking executive, Patrick Bateman, hides his alternate psychopathic ego from his co-workers and friends as he delves deeper into his violent, hedonistic fantasies.",Mary Harron ,"Christian Bale, Justin Theroux, Josh Lucas, Bill Sage",521903,$15.07M
122,123,Beauty and the Beast,1991,84 min,"Animation, Family, Fantasy            ",8,ince cursed to spend his days as a hideous monster sets out to regain his humanity by earning a young woman's love.,"Gary Trousdale, Kirk Wise ","Paige O'Hara, Robby Benson, Jesse Corti, Rex Everhart",427250,$218.97M
123,124,The Departed,2006,151 min,"Crime, Drama, Thriller            ",8.5,ime action film about an undercover cop and a mole in the police attempting to identify each other while infiltrating an Irish gang in South Boston.,Martin Scorsese ,"Leonardo DiCaprio, Matt Damon, Jack Nicholson, Mark Wahlberg",1235586,$132.38M
124,125,Fargo,1996,98 min,"Crime, Drama, Thriller            ",8.1,y Lundegaard's inept crime falls apart due to his and his henchmen's bungling and the persistent police work of the quite pregnant Marge Gunderson.,"Joel Coen, Ethan Coen ","William H. Macy, Frances McDormand, Steve Buscemi, Peter Stormare",641178,$24.61M
125,126,The Jungle Book,2016,106 min,"Adventure, Drama, Family            ",7.4,"r a threat from the tiger Shere Khan forces him to flee the jungle, a man-cub named Mowgli embarks on a journey of self discovery with the help of panther Bagheera and free-spirited bear Baloo.",Jon Favreau ,"Neel Sethi, Bill Murray, Ben Kingsley, Idris Elba",266340,$364.00M
126,127,The Lion King,1994,88 min,"Animation, Adventure, Drama            ",8.5," prince Simba and his father are targeted by his bitter uncle, who wants to ascend the throne himself.","Roger Allers, Rob Minkoff ","Matthew Broderick, Jeremy Irons, James Earl Jones, Whoopi Goldberg",979529,$422.78M
127,128,Mary Poppins,1964,139 min,"Comedy, Family, Fantasy            ",7.8,"urn of the century London, a magical nanny employs music and adventure to help two neglected children become closer to their father.",Robert Stevenson ,"Julie Andrews, Dick Van Dyke, David Tomlinson, Glynis Johns",163078,$102.27M
128,129,Planet of the Apes,1968,112 min,"Adventure, Sci-Fi            ",8,"stronaut crew crash-lands on a planet in the distant future where intelligent talking apes are the dominant species, and humans are the oppressed and enslaved.",Franklin J. Schaffner ,"Charlton Heston, Roddy McDowall, Kim Hunter, Maurice Evans",171662,$33.40M
129,130,Scarface,1983,170 min,"Crime, Drama            ",8.3,"980 Miami, a determined Cuban immigrant takes over a drug cartel and succumbs to greed.",Brian De Palma ,"Al Pacino, Michelle Pfeiffer, Steven Bauer, Mary Elizabeth Mastrantonio",774885,$45.60M
130,131,The Wolf of Wall Street,2013,180 min,"Biography, Crime, Drama            ",8.2,"d on the true story of Jordan Belfort, from his rise to a wealthy stock-broker living the high life to his fall involving crime, corruption and the federal government.",Martin Scorsese ,"Leonardo DiCaprio, Jonah Hill, Margot Robbie, Matthew McConaughey",1256537,$116.90M
131,132,Toy Story,1995,81 min,"Animation, Adventure, Comedy            ",8.3,wboy doll is profoundly threatened and jealous when a new spaceman figure supplants him as top toy in a boy's room.,John Lasseter ,"Tom Hanks, Tim Allen, Don Rickles, Jim Varney",923393,$191.80M
132,133,Amadeus,1984,160 min,"Biography, Drama, History            ",8.3,"life, success and troubles of Wolfgang Amadeus Mozart, as told by Antonio Salieri, the contemporaneous composer who was insanely jealous of Mozart's talent and claimed to have murdered him.",Milos Forman ,"F. Murray Abraham, Tom Hulce, Elizabeth Berridge, Roy Dotrice",381015,$51.97M
133,134,To Kill a Mockingbird,1962,129 min,"Crime, Drama            ",8.3,"cus Finch, a lawyer in the Depression-era South, defends a black man against an undeserved rape charge, and his children against prejudice.",Robert Mulligan ,"Gregory Peck, John Megna, Frank Overton, Rosemary Murphy",303341,
134,135,Monty Python and the Holy Grail,1975,91 min,"Adventure, Comedy, Fantasy            ",8.2," Arthur and his Knights of the Round Table embark on a surreal, low-budget search for the Holy Grail, encountering many, very silly obstacles.","Terry Gilliam, Terry Jones ","Graham Chapman, John Cleese, Eric Idle, Terry Gilliam",516072,$1.23M
135,136,Lawrence of Arabia,1962,228 min,"Adventure, Biography, Drama            ",8.3,"story of T.E. Lawrence, the English officer who successfully united and led the diverse, often warring, Arab tribes during World War I in order to fight the Turks.",David Lean ,"Peter O'Toole, Alec Guinness, Anthony Quinn, Jack Hawkins",278538,$44.82M
136,137,Toy Story 3,2010,103 min,"Animation, Adventure, Comedy            ",8.2,"toys are mistakenly delivered to a day-care center instead of the attic right before Andy leaves for college, and it's up to Woody to convince the other toys that they weren't abandoned and to return home.",Lee Unkrich ,"Tom Hanks, Tim Allen, Joan Cusack, Ned Beatty",783458,$415.00M
137,138,Some Like It Hot,1959,121 min,"Comedy, Music, Romance            ",8.2,"r two male musicians witness a mob hit, they flee the state in an all-female band disguised as women, but further complications set in.",Billy Wilder ,"Marilyn Monroe, Tony Curtis, Jack Lemmon, George Raft",253681,$25.00M
138,139,Singin' in the Rain,1952,103 min,"Comedy, Musical, Romance            ",8.3,lent film production company and cast make a difficult transition to sound.,"Stanley Donen, Gene Kelly ","Gene Kelly, Donald O'Connor, Debbie Reynolds, Jean Hagen",227729,$8.82M
139,140,Idi i smotri,1985,142 min,"Drama, Thriller, War            ",8.3,"r finding an old rifle, a young boy joins the Soviet resistance movement against ruthless German forces and experiences the horrors of World War II.",Elem Klimov ,"Aleksey Kravchenko, Olga Mironova, Liubomiras Laucevicius, Vladas Bagdonas",67058,
140,141,Metropolis,1927,153 min,"Drama, Sci-Fi            ",8.3," futuristic city sharply divided between the working class and the city planners, the son of the city's mastermind falls in love with a working-class prophet who predicts the coming of a savior to mediate their differences.",Fritz Lang ,"Brigitte Helm, Alfred Abel, Gustav Fröhlich, Rudolf Klein-Rogge",166088,$1.24M
141,142,The Sting,1973,129 min,"Comedy, Crime, Drama            ",8.3,grifters team up to pull off the ultimate con.,George Roy Hill ,"Paul Newman, Robert Redford, Robert Shaw, Charles Durning",249806,$159.60M
142,143,The Third Man,1949,104 min,"Film-Noir, Mystery, Thriller            ",8.1," novelist Holly Martins travels to shadowy, postwar Vienna, only to find himself investigating the mysterious death of an old friend, Harry Lime.",Carol Reed ,"Orson Welles, Joseph Cotten, Alida Valli, Trevor Howard",164593,$0.45M
143,144,Per qualche dollaro in più,1965,132 min,Western            ,8.2,bounty hunters with the same intentions team up to track down a Western outlaw.,Sergio Leone ,"Clint Eastwood, Lee Van Cleef, Gian Maria Volontè, Mara Krupp",242221,$15.00M
144,145,The Apartment,1960,125 min,"Comedy, Drama, Romance            ",8.3,"n tries to rise in his company by letting its executives use his apartment for trysts, but complications and a romance of his own ensue.",Billy Wilder ,"Jack Lemmon, Shirley MacLaine, Fred MacMurray, Ray Walston",171350,$18.60M
145,146,Judgment at Nuremberg,1961,179 min,"Drama, War            ",8.2,"948, an American court in occupied Germany tries four Nazis judged for war crimes.",Stanley Kramer ,"Spencer Tracy, Burt Lancaster, Richard Widmark, Marlene Dietrich",73341,
146,147,All About Eve,1950,138 min,Drama            ,8.2,emingly timid but secretly ruthless ingénue insinuates herself into the lives of an aging Broadway star and her circle of theater friends.,Joseph L. Mankiewicz ,"Bette Davis, Anne Baxter, George Sanders, Celeste Holm",125393,$0.01M
147,148,Rang De Basanti,2006,167 min,"Comedy, Crime, Drama            ",8.1,"story of six young Indians who assist an English woman to film a documentary on the freedom fighters from their past, and the events that lead them to relive the long-forgotten saga of freedom.",Rakeysh Omprakash Mehra ,"Aamir Khan, Soha Ali Khan, Siddharth, Sharman Joshi",116208,$2.20M
148,149,Double Indemnity,1944,107 min,"Crime, Drama, Film-Noir            ",8.3,nsurance representative lets himself be talked by a seductive housewife into a murder/insurance fraud scheme that arouses the suspicion of an insurance investigator.,Billy Wilder ,"Fred MacMurray, Barbara Stanwyck, Edward G. Robinson, Byron Barr",149354,$5.72M
149,150,Rashômon,1950,88 min,"Crime, Drama, Mystery            ",8.2,"rape of a bride and the murder of her samurai husband are recalled from the perspectives of a bandit, the bride, the samurai's ghost and a woodcutter.",Akira Kurosawa ,"Toshirô Mifune, Machiko Kyô, Masayuki Mori, Takashi Shimura",159252,$0.10M
150,151,Ladri di biciclette,1948,89 min,Drama            ,8.3,"ost-war Italy, a working-class man's bicycle is stolen. He and his son set out to find it.",Vittorio De Sica ,"Lamberto Maggiorani, Enzo Staiola, Lianella Carell, Elena Altieri",154938,$0.33M
151,152,Andrei Rublev,1969,205 min,"Biography, Drama, History            ",8.1,"life, times and afflictions of the fifteenth-century Russian iconographer St. Andrei Rublev.",Andrei Tarkovsky ,"Anatoliy Solonitsyn, Ivan Lapikov, Nikolay Grinko, Nikolay Sergeev",50468,$0.10M
152,153,Yôjinbô,1961,110 min,"Action, Drama, Thriller            ",8.2,afty ronin comes to a town divided by two criminal gangs and decides to play them against each other to free the town.,Akira Kurosawa ,"Toshirô Mifune, Eijirô Tôno, Tatsuya Nakadai, Yôko Tsukasa",116627,
153,154,Gangs of Wasseypur,2012,321 min,"Action, Crime, Drama            ",8.2,"ash between Sultan and Shahid Khan leads to the expulsion of Khan from Wasseypur, and ignites a deadly blood feud spanning three generations.",Anurag Kashyap ,"Manoj Bajpayee, Richa Chadha, Nawazuddin Siddiqui, Tigmanshu Dhulia",89110,
154,155,The Treasure of the Sierra Madre,1948,126 min,"Adventure, Drama, Western            ",8.2,Americans searching for work in Mexico convince an old prospector to help them mine for gold in the Sierra Madre Mountains.,John Huston ,"Humphrey Bogart, Walter Huston, Tim Holt, Bruce Bennett",119100,$5.01M
155,156,The Kid,1921,68 min,"Comedy, Drama, Family            ",8.3,"Tramp cares for an abandoned child, but events put that relationship in jeopardy.",Charles Chaplin ,"Charles Chaplin, Edna Purviance, Jackie Coogan, Carl Miller",119485,$5.45M
156,157,Ikiru,1952,143 min,Drama            ,8.3,reaucrat tries to find meaning in his life after he discovers he has terminal cancer.,Akira Kurosawa ,"Takashi Shimura, Nobuo Kaneko, Shin'ichi Himori, Haruo Tanaka",73160,$0.06M
157,158,A Wednesday,2008,104 min,"Action, Crime, Drama            ",8.1,tiring police officer reminisces about the most astounding day of his career. About a case that was never filed but continues to haunt him in his memories - the case of a man and a Wednesday.,Neeraj Pandey ,"Anupam Kher, Naseeruddin Shah, Virendra Saxena, Mahesh Kanual",76163,
158,159,Sunrise: A Song of Two Humans,1927,94 min,"Drama, Romance            ",8.1,"phisticated urban woman seduces a farmer in the hopes that he will murder his neglected wife and join her in the city, but he soon finds himself rekindling his romance with the latter when she discovers their scheme.",F.W. Murnau ,"George O'Brien, Janet Gaynor, Margaret Livingston, Bodil Rosing",49257,$0.54M
159,160,La passion de Jeanne d'Arc,1928,110 min,"Biography, Drama, History            ",8.1,"431, Jeanne d'Arc is placed on trial on charges of heresy. The ecclesiastical jurists attempt to force Jeanne to recant her claims of holy visions.",Carl Theodor Dreyer ,"Maria Falconetti, Eugene Silvain, André Berley, Maurice Schutz",50990,$0.02M
160,161,Sholay,1975,204 min,"Action, Adventure, Comedy            ",8.2,"r his family is murdered by a notorious and ruthless bandit, a former police officer enlists the services of two outlaws to capture the bandit.",Ramesh Sippy ,"Sanjeev Kumar, Dharmendra, Amitabh Bachchan, Amjad Khan",53455,
161,162,Munna Bhai M.B.B.S.,2003,156 min,"Comedy, Drama            ",8.1,ngster sets out to fulfill his father's dream of becoming a doctor.,Rajkumar Hirani ,"Sanjay Dutt, Arshad Warsi, Gracy Singh, Sunil Dutt",77558,
162,163,Andaz Apna Apna,1994,160 min,"Action, Comedy, Romance            ",8.1,slackers competing for the affections of an heiress inadvertently become her protectors from an evil criminal.,Rajkumar Santoshi ,"Aamir Khan, Salman Khan, Raveena Tandon, Karisma Kapoor",51581,
